<?xml version="1.0" encoding="utf-8"?>
<ead xmlns="urn:isbn:1-931666-22-9" xmlns:xlink="http://www.w3.org/1999/xlink" xmlns:xsi="http://www.w3.org/2001/XMLSchema-instance" xsi:schemaLocation="urn:isbn:1-931666-22-9 http://www.loc.gov/ead/ead.xsd"><eadheader countryencoding="iso3166-1" dateencoding="iso8601" langencoding="iso639-2b" repositoryencoding="iso15511"><eadid countrycode="US" mainagencycode="US-NNU-F" url="https://findingaids.library.nyu.edu/fales/mss_426/">mss_426</eadid><filedesc><titlestmt><titleproper>Guide to the Gay U.S.A. Collection <num>MSS.426</num></titleproper><author>Colin Drohan and Sophie Glidden-Lyon</author></titlestmt><publicationstmt><publisher>Fales Library and Special Collections</publisher></publicationstmt></filedesc><profiledesc><creation>This finding aid was produced using ArchivesSpace on <date>2023-08-20 17:04:20 -0400</date>.</creation><langusage>Description is in English</langusage><descrules>Describing Archives: A Content Standard</descrules></profiledesc></eadheader><archdesc level="collection">
  <did>
    <repository>
      <corpname>Fales Library and Special Collections</corpname>
    </repository>
    <unittitle>Gay USA Collection</unittitle>
    <origination label="creator">
      <persname source="local">Humm, Andy</persname>
    </origination>
    <origination label="creator">
      <persname rules="dacs" source="local">Northrop, Ann</persname>
    </origination>
    <unitid>MSS.426</unitid>
    <physdesc altrender="whole">
      <extent altrender="materialtype spaceoccupied">12.25 Linear Feet</extent>
      <extent altrender="carrier">10 Boxes</extent>
    </physdesc>
    <unitdate datechar="creation" normal="2002-09-02/2012-11-22" type="inclusive">2002-09-02-2012-11-22</unitdate>
    <abstract id="aspace_7862ec75f9e5bf26f9eeaa6a441b86aa">The Gay USA Collection contains over 500 recordings of the hour long weekly news program <emph render="italic">Gay USA</emph> which airs on the Manhattan News Network and is distributed by Free Speech TV. Gay USA was created in the early 1980's by gay activist and video producer Lou Maletta, who also founded the Gay Cable Network (GCN) in 1982. Hosted by Andy Humm since 1985, Ann Northrop joined as co-host in 1996. The program covers LGBT current events and issues, often including interviews and special events. The majority of the recordings are in DVCAM format, with a few VHS and one DVD-R.</abstract>
    <langmaterial id="aspace_3a02b4a22f8129cce2f418735e6e0b59">Collection is in English.</langmaterial>
  </did>
  <arrangement id="aspace_9095f90c5a9941740b01aa7ae935ac09">
    <head>Arrangement</head>
<p>The material is arranged chronologically. When more than one date is recorded, the date indicated on the barcode sticker is used. Paper material is arranged in the second series.</p>  </arrangement>
  <bioghist id="aspace_e53603e4825f0f7cbb49564ab9e0cdfd">
    <head>Historical note</head>
<p><emph render="italic">Gay USA</emph> is a weekly news program dedicated to LGBT current events, history and issues facing the community both domestically and internationally. Founded in the early 1980's by gay activist and video producer Lou Maletta, who also founded the Gay Cable Network (GCN) in 1982. Hosted by Andy Humm since 1985, Ann Northrop joined as co-host in 1996. Created to counter the poor mainstream reporting on LGBT issues, specifically the AIDS epidemic, the program provides in depth analytical reporting and interviews rooted in LGBT activism and history. <emph render="italic">Gay USA</emph> covered both the Democratic and Republican Conventions from 1984 to 2000, as well as the demonstrations occurring across the country surrounding LGBT and AIDS issues. The show originally aired on GCN before moving to the Manhattan Neighborhood Network (MNN) in 2001, and is distributed nationally by Free Speech TV. It is also available online via Free Speech TV's youtube channel.</p><p>Andy Humm began his career in journalism in the 1970's and began hosting <emph render="italic">Gay USA</emph> in 1985. In addition to his work as co-anchor, he has hosted a variety of other programs, including <emph render="italic">Informed Sources</emph> (1991-1995), a weekly public affairs roundtable, <emph render="italic">Self-Help</emph> (1979-84), a weekly interview with leaders of mutual aid groups on WBAI-FM radio, segments of the <emph render="italic">Live Wire</emph> and<emph render="italic"> Thirteen Live</emph> public affairs programs in 1991, and the national PBS special, <emph render="italic">Out in America</emph>. In print journalism, Humm has written for <emph render="italic">New York City News, Gay City News, the Village Voice, POZ</emph> and <emph render="italic">Next</emph> Magazines. Humm holds a Masters in Public Health and teaches at Hunter College's School of Urban Health where he was named a Distinguished Alumnus in 2001. He was also Director of Education at the Hetrick-Martin Institute for Lesbian and Gay Youth from 1986-95. </p><p>Ann Northrop joined <emph render="italic">Gay USA</emph> in 1996, but has worked in television since the 1970's. She did work as a freelance production assistant, wrote criticism for a nationally syndicated column, as well as writing for <emph render="italic">Ms.</emph> Magazine and <emph render="italic">Ladies' Home Journal. </emph>In 1981, Northrop joined ABC's "Good Morning America" as a writer-producer and was then recruited by George Merlis to join him at CBS News as a producer. After five years with CBS, she left and accepted a job as an AIDS educator and educator on homosexuality at New York's Hetrick-Martin Institute for Lesbian and Gay Youth. Working as an AIDS educator reconnected her with her early activist roots with the anti-war effort in the 1960s and 70s as well as with the LGBT community in New York City. After four years at the Hetrick-Martin Institute, she left to pursue other activist and advocate work on behalf of LGBT issues. Her arrival at <emph render="italic">Gay USA</emph> was her return to television.</p>  </bioghist>
  <accessrestrict id="aspace_f5e6cb58fd27a4f2f272fa33ba8bee96">
    <head>Conditions Governing Access</head>
<p>Materials are open to researchers. Please contact the Fales Library and Special Collections, fales.library@nyu.edu, 212-998-2596.</p>  </accessrestrict>
  <userestrict id="aspace_75b4e595fbaccbbfbc15d7cb57849667">
    <head>Conditions Governing Use</head>
<p>This collection and any rights therein (including copyright and related rights to publicity and privacy) are held by the creator, and NYU's use of the collection is governed by written agreement. Per said agreement, these materials are available under a Creative Commons CC by 4.0 license, which permits publication and reproduction of materials accompanied by full attribution. See, https://creativecommons.org/licenses/by/4.0/.</p>  </userestrict>
  <acqinfo id="aspace_aa3110673ec59609a9cbc095cdc1de92">
    <head>Provenance</head>
<p>Purchased from Andy Humm.</p>  </acqinfo>
  <prefercite id="aspace_1aa6c08316278a43822539112bdd44ef">
    <head>Preferred Citation</head>
<p>Published citations should take thefollowing form:</p><p>Identification of item, date (if known); The Gay U.S.A. Collection; MSS 426; box number; folder number; Fales Library and Special Collections, New York University Libraries.</p>  </prefercite>
  <scopecontent id="aspace_877fbf040d24a4cef5052224e55ac27a">
    <head>Scope and Content</head>
<p>The Gay USA Collection contains over 500 recordings of the Gay USA news program. This includes their regular programming, as well as interviews and special events. Most of the tapes are in DVCAM format, although there are a few VHS tapes, and one DVD-R. The material spans the years 2002-2012, inclusively, with one undated tape. Additionally, there is one folder with paper material relating to the program.</p>  </scopecontent>
  <relatedmaterial id="aspace_96ccfe0150e55ce3f8b6bea2282fd08f">
    <head>Related Materials</head>
<p>Gay Cable Network Archives</p>  </relatedmaterial>
  <controlaccess>
    <subject source="lcsh">Gay activists -- New York (State) -- New York.</subject>
    <subject source="lcsh">Gays -- Political activity -- New York (State) -- New York.</subject>
    <subject source="lcsh">Cable television -- Access</subject>
    <subject source="lcsh">Public-access television -- United States</subject>
    <persname rules="aacr" source="local">Maletta, Louis P.</persname>
  </controlaccess>
  <dsc><c id="aspace_ref1" level="series"><did><unittitle>Series I: Video recordings</unittitle><unitdate datechar="creation" normal="2000/2012" type="inclusive">2000-2012</unitdate></did><accessrestrict id="aspace_08698f0549a6e82765b2057d8ea71270"><head>Conditions Governing Access</head><p>Access copies for the audiovisual materials in the collection are available.</p></accessrestrict><c id="aspace_c37581774c794ff8f610aff9a47f35dc" level="item"><did><unittitle>Gay USA Great Intro of Me</unittitle><unitid>426.6001</unitid><unitdate datechar="creation" normal="2000/2001" type="inclusive">2000-2001</unitdate><container altrender="Record carton" id="aspace_cc7d662fdf2e22dc64841f88201938bb" label="Moving Images [31142063429529]" type="Box">10</container><container parent="aspace_cc7d662fdf2e22dc64841f88201938bb" type="Media">ID: 426.6001</container><dao xlink:actuate="onRequest" xlink:href="https://hdl.handle.net/2333.1/5tb2rkt7" xlink:role="video-service" xlink:show="new" xlink:title="Gay USA Great Intro of Me" xlink:type="simple"><daodesc><p>Gay USA Great Intro of Me: 2000-2001</p></daodesc></dao></did><phystech id="aspace_57e9b1b2e37aaaa6bb67f4cfb8d8b5df"><head>Physical Characteristics and Technical Requirements</head><p>Color, sound</p><p>Duration: 60 minutes</p><p>Original format: MiniDV</p></phystech></c><c id="aspace_96fe43a4fc8fae7b0aeb498a69e6362c" level="item"><did><unittitle>Gay USA First Show After Cancel First Few Minutes</unittitle><unitid>426.5996</unitid><unitdate datechar="creation" normal="2000/2001" type="inclusive">2000-2001</unitdate><container altrender="Record carton" id="aspace_c85986c48912cd37a85912cb921b28cf" label="Moving Images [31142063429529]" type="Box">10</container><container parent="aspace_c85986c48912cd37a85912cb921b28cf" type="Media">ID: 426.5996</container><dao xlink:actuate="onRequest" xlink:href="https://hdl.handle.net/2333.1/g1jwt63w" xlink:role="video-service" xlink:show="new" xlink:title="Gay USA First Show After Cancel First Few Minutes" xlink:type="simple"><daodesc><p>Gay USA First Show After Cancel First Few Minutes: 2000-2001</p></daodesc></dao></did><phystech id="aspace_0557659fbc61e14a5d7d813cd20aeab8"><head>Physical Characteristics and Technical Requirements</head><p>Color, sound</p><p>Duration: 60 minutes</p><p>Original format: MiniDV</p></phystech></c><c id="aspace_20c40f136cfa25f46e63aab786af23f4" level="item"><did><unittitle>Gay USA BP2K Last 32 Minutes Free</unittitle><unitid>426.6010</unitid><unitdate datechar="creation" normal="2000/2001" type="inclusive">2000-2001</unitdate><container altrender="Record carton" id="aspace_dae4e03e60f63539793f7c0ee3f78280" label="Moving Images [31142063429529]" type="Box">10</container><container parent="aspace_dae4e03e60f63539793f7c0ee3f78280" type="Media">ID: 426.6010</container><dao xlink:actuate="onRequest" xlink:href="https://hdl.handle.net/2333.1/material-request-placeholder" xlink:role="video-reading-room" xlink:show="new" xlink:title="Gay USA BP2K Last 32 Minutes Free" xlink:type="simple"><daodesc><p>Gay USA BP2K Last 32 Minutes Free: 2000-2001</p></daodesc></dao></did><phystech id="aspace_cdcd2e264cad2a96500d4c679362e8d2"><head>Physical Characteristics and Technical Requirements</head><p>Color, Sound</p><p>Duration: 60 minutes</p><p>Original format: MiniDV</p></phystech><scopecontent id="aspace_054375f622068863f06f3c95aa91123c"><head>Scope and Contents</head><p>Content warning: this recording contains pornographic content.</p></scopecontent></c><c id="aspace_3360b3738a7d77f639614c855e54231e" level="item"><did><unittitle>Gay USA Expo Commercial 2</unittitle><unitid>426.6011</unitid><unitdate datechar="creation" normal="2000/2001" type="inclusive">2000-2001</unitdate><container altrender="Record carton" id="aspace_b7eea0fde8f73e736098202d7e17eb07" label="Moving Images [31142063429529]" type="Box">10</container><container parent="aspace_b7eea0fde8f73e736098202d7e17eb07" type="Media">ID: 426.6011</container><dao xlink:actuate="onRequest" xlink:href="https://hdl.handle.net/2333.1/z34tn1z4" xlink:role="video-service" xlink:show="new" xlink:title="Gay USA Expo Commercial 2" xlink:type="simple"><daodesc><p>Gay USA Expo Commercial 2: 2000-2001</p></daodesc></dao></did><phystech id="aspace_df8020b1e61e794a87b5b243391645ad"><head>Physical Characteristics and Technical Requirements</head><p>Color, Sound</p><p>Duration: 60 minutes</p><p>Original format: MiniDV</p></phystech></c><c id="aspace_9112830e4502926eb5d5e77e68f5e13f" level="item"><did><unittitle>Gay USA 15 August Demo-Egypt-Consulate</unittitle><unitid>426.6005</unitid><unitdate datechar="creation" normal="2000/2001" type="inclusive">2000-2001</unitdate><container altrender="Record carton" id="aspace_bad0218c4746cc1b8ca4614b6849905f" label="Moving Images [31142063429529]" type="Box">10</container><container parent="aspace_bad0218c4746cc1b8ca4614b6849905f" type="Media">ID: 426.6005</container><dao xlink:actuate="onRequest" xlink:href="https://hdl.handle.net/2333.1/ns1rnj0z" xlink:role="video-service" xlink:show="new" xlink:title="Gay USA 15 August Demo-Egypt-Consulate" xlink:type="simple"><daodesc><p>Gay USA 15 August Demo-Egypt-Consulate: 2000-2001</p></daodesc></dao></did><phystech id="aspace_321fa8c1d047fe9fd627e72500bc1d6f"><head>Physical Characteristics and Technical Requirements</head><p>Color, Sound</p><p>Duration: 60 minutes</p><p>Original format: MiniDV</p></phystech></c><c id="aspace_91844857049246ff341b6e82a4935e4a" level="item"><did><unittitle>Gay USA 15 August 2 of</unittitle><unitid>426.6009</unitid><unitdate datechar="creation" normal="2000/2001" type="inclusive">2000-2001</unitdate><container altrender="Record carton" id="aspace_8e19e8e76baa2ee68a81f158e4d973ff" label="Moving Images [31142063429529]" type="Box">10</container><container parent="aspace_8e19e8e76baa2ee68a81f158e4d973ff" type="Media">ID: 426.6009</container><dao xlink:actuate="onRequest" xlink:href="https://hdl.handle.net/2333.1/4tmpgcnp" xlink:role="video-service" xlink:show="new" xlink:title="Gay USA 15 August 2 of" xlink:type="simple"><daodesc><p>Gay USA 15 August 2 of: 2000-2001</p></daodesc></dao></did><phystech id="aspace_0b00f39cca50ea89a1f977fb8c243783"><head>Physical Characteristics and Technical Requirements</head><p>Color, Sound</p><p>Duration: 60 minutes</p><p>Original Format: MiniDV</p></phystech></c><c id="aspace_c17c3319f5f5e4b74843919361690b9d" level="item"><did><unittitle>Gay USA 19 July Democrat Mayoral Candidate 1 of 3</unittitle><unitid>426.6002</unitid><unitdate datechar="creation" normal="2000/2001" type="inclusive">2000-2001</unitdate><container altrender="Record carton" id="aspace_e55d9fae44e7a1296f0bf7855866b471" label="Moving Images [31142063429529]" type="Box">10</container><container parent="aspace_e55d9fae44e7a1296f0bf7855866b471" type="Media">ID: 426.6002</container><dao xlink:actuate="onRequest" xlink:href="https://hdl.handle.net/2333.1/2280gkbc" xlink:role="video-service" xlink:show="new" xlink:title="Gay USA 19 July Democrat Mayoral Candidate 1 of 3" xlink:type="simple"><daodesc><p>Gay USA 19 July Democrat Mayoral Candidate 1 of 3: 2000-2001</p></daodesc></dao></did><phystech id="aspace_eb528508d8f8254d04930a8af8eeeb09"><head>Physical Characteristics and Technical Requirements</head><p>Color, Sound</p><p>Duration: 60 minutes</p><p>Original Format: MiniDV</p></phystech></c><c id="aspace_a19f78016924eed28b61cf9718e60f86" level="item"><did><unittitle>Gay USA 19 July Democrat Mayoral 2 of 3</unittitle><unitid>426.6007</unitid><unitdate datechar="creation" normal="2000/2001" type="inclusive">2000-2001</unitdate><container altrender="Record carton" id="aspace_3e985ba470a606e8aa0d862745cde908" label="Moving Images [31142063429529]" type="Box">10</container><container parent="aspace_3e985ba470a606e8aa0d862745cde908" type="Media">ID: 426.6007</container><dao xlink:actuate="onRequest" xlink:href="https://hdl.handle.net/2333.1/d7wm3gx0" xlink:role="video-service" xlink:show="new" xlink:title="Gay USA 19 July Democrat Mayoral 2 of 3" xlink:type="simple"><daodesc><p>Gay USA 19 July Democrat Mayoral 2 of 3: 2000-2001</p></daodesc></dao></did><phystech id="aspace_09e470977814e54beffb65972c8ee169"><head>Physical Characteristics and Technical Requirements</head><p>Color, Sound</p><p>Duration: 60 minutes</p><p>Original Format: MiniDV</p></phystech></c><c id="aspace_96fe8c120458b544bcdd42ae7229eed2" level="item"><did><unittitle>Gay USA 19 July Democrat Mayoral Candidate 3 of 3</unittitle><unitid>426.6006</unitid><unitdate datechar="creation" normal="2000/2001" type="inclusive">2000-2001</unitdate><container altrender="Record carton" id="aspace_5fa90ca645bba88428258910567e3db7" label="Moving Images [31142063429529]" type="Box">10</container><container parent="aspace_5fa90ca645bba88428258910567e3db7" type="Media">ID: 426.6006</container><dao xlink:actuate="onRequest" xlink:href="https://hdl.handle.net/2333.1/j0zpchfb" xlink:role="video-service" xlink:show="new" xlink:title="Gay USA 19 July Democrat Mayoral Candidate 3 of 3" xlink:type="simple"><daodesc><p>Gay USA 19 July Democrat Mayoral Candidate 3 of 3: 2000-2001</p></daodesc></dao></did><phystech id="aspace_107a393a698aa427757f4cce66fb26b9"><head>Physical Characteristics and Technical Requirements</head><p>Color, Sound</p><p>Duration: 60 minutes</p><p>Original Format: MiniDV</p></phystech></c><c id="aspace_580b533ffda183cd1ec5d7cf8c0a7af7" level="item"><did><unittitle>Gay USA 24 June Tom of Finland Art &amp; Pier Dance</unittitle><unitid>426.6012</unitid><unitdate datechar="creation" normal="2000/2001" type="inclusive">2000-2001</unitdate><container altrender="Record carton" id="aspace_8e5206422eb8a67a251d80089a8a9d8c" label="Moving Images [31142063429529]" type="Box">10</container><container parent="aspace_8e5206422eb8a67a251d80089a8a9d8c" type="Media">ID: 426.6012</container><dao xlink:actuate="onRequest" xlink:href="https://hdl.handle.net/2333.1/tb2rc1dr" xlink:role="video-service" xlink:show="new" xlink:title="Gay USA 24 June Tom of Finland Art &amp;amp; Pier Dance" xlink:type="simple"><daodesc><p>Gay USA 24 June Tom of Finland Art &amp; Pier Dance: 2000-2001</p></daodesc></dao></did><phystech id="aspace_00e04cb6a03e51412942e915d64565de"><head>Physical Characteristics and Technical Requirements</head><p>Color, Sound</p><p>Duration: 60 minutes</p><p>Original Format: 60 minutes</p></phystech></c><c id="aspace_b4df1f0c65da3dd077f1f5535beb93c7" level="item"><did><unittitle>Gay USA 24 June Parade</unittitle><unitid>426.6003</unitid><unitdate datechar="creation" normal="2000/2001" type="inclusive">2000-2001</unitdate><container altrender="Record carton" id="aspace_da104f833e9b6298f2bc0bfbcdaf000e" label="Moving Images [31142063429529]" type="Box">10</container><container parent="aspace_da104f833e9b6298f2bc0bfbcdaf000e" type="Media">ID: 426.6003</container><dao xlink:actuate="onRequest" xlink:href="https://hdl.handle.net/2333.1/x95x6k0b" xlink:role="video-service" xlink:show="new" xlink:title="Gay USA 24 June Parade" xlink:type="simple"><daodesc><p>Gay USA 24 June Parade: 2000-2001</p></daodesc></dao></did><phystech id="aspace_dcb26f69c8029874533b60b60155f3f3"><head>Physical Characteristics and Technical Requirements</head><p>Color, Sound</p><p>Duration: 60 Minutes</p><p>Original Format: MiniDV</p></phystech></c><c id="aspace_28ee5a994ee3ec8b95d4e361a19ba267" level="item"><did><unittitle>Gay USA 25 Wed Intros</unittitle><unitid>426.6004</unitid><unitdate datechar="creation" normal="2000/2001" type="inclusive">2000-2001</unitdate><container altrender="Record carton" id="aspace_cf8578e8a0614dab7d34f4172dfcd253" label="Moving Images [31142063429529]" type="Box">10</container><container parent="aspace_cf8578e8a0614dab7d34f4172dfcd253" type="Media">ID: 426.6004</container><dao xlink:actuate="onRequest" xlink:href="https://hdl.handle.net/2333.1/sj3txjh3" xlink:role="video-service" xlink:show="new" xlink:title="Gay USA 25 Wed Intros" xlink:type="simple"><daodesc><p>Gay USA 25 Wed Intros: 2000-2001</p></daodesc></dao></did><phystech id="aspace_2459adfc8eca826f2234571085e9012d"><head>Physical Characteristics and Technical Requirements</head><p>Color, Sound</p><p>Duration: 60 minutes</p><p>Original Format: MiniDV</p></phystech></c><c id="aspace_ffe5a395ab76fa4822103599d54837c5" level="item"><did><unittitle>Gay USA 25 July 2 of</unittitle><unitid>426.6008</unitid><unitdate datechar="creation" normal="2000/2001" type="inclusive">2000-2001</unitdate><container altrender="Record carton" id="aspace_2130ddb1731ae0a40abd81119ed380e4" label="Moving Images [31142063429529]" type="Box">10</container><container parent="aspace_2130ddb1731ae0a40abd81119ed380e4" type="Media">ID: 426.6008</container><dao xlink:actuate="onRequest" xlink:href="https://hdl.handle.net/2333.1/8kprrd4s" xlink:role="video-service" xlink:show="new" xlink:title="Gay USA 25 July 2 of" xlink:type="simple"><daodesc><p>Gay USA 25 July 2 of: 2000-2001</p></daodesc></dao></did><phystech id="aspace_017c72dba9e5374746ad85f9cf718ddf"><head>Physical Characteristics and Technical Requirements</head><p>Color, Sound</p><p>Duration: 60 minutes</p><p>Original format: MiniDV</p></phystech></c><c id="aspace_9130441ee1f75a4dda88672474a7b44d" level="item"><did><unittitle>Gay USA Partial Episode and Club Bondage Performance</unittitle><unitid>426.5997</unitid><unitdate datechar="creation" normal="2000/2001" type="inclusive">2000-2001</unitdate><container altrender="Record carton" id="aspace_f8f46a94a25cc65fc9494ef0d83a06ca" label="Moving Images [31142063429529]" type="Box">10</container><container parent="aspace_f8f46a94a25cc65fc9494ef0d83a06ca" type="Media">ID: 426.5997</container><dao xlink:actuate="onRequest" xlink:href="https://hdl.handle.net/2333.1/material-request-placeholder" xlink:role="video-reading-room" xlink:show="new" xlink:title="Gay USA Partial Episode and Club Bondage Performance" xlink:type="simple"><daodesc><p>Gay USA Partial Episode and Club Bondage Performance: 2000-2001</p></daodesc></dao></did><phystech id="aspace_edd63aae272aedfc23492da8ef56f02c"><head>Physical Characteristics and Technical Requirements</head><p>Color, Sound	</p><p>Duration: 40:16</p><p>Original format: MiniDV</p></phystech></c><c id="aspace_88ff3d1773e51d2afaaf2095510328ab" level="item"><did><unittitle>Gay USA Bondage Pornography</unittitle><unitid>426.5998</unitid><unitdate datechar="creation" normal="2000/2001" type="inclusive">2000-2001</unitdate><container altrender="Record carton" id="aspace_a11183297a471f3b19e8733875d798b9" label="Moving Images [31142063429529]" type="Box">10</container><container parent="aspace_a11183297a471f3b19e8733875d798b9" type="Media">426.5998</container><dao xlink:actuate="onRequest" xlink:href="https://hdl.handle.net/2333.1/material-request-placeholder" xlink:role="video-reading-room" xlink:show="new" xlink:title="Gay USA Bondage Pornography" xlink:type="simple"><daodesc><p>Gay USA Bondage Pornography: 2000-2001</p></daodesc></dao></did><phystech id="aspace_499c249cef6d85fe27b2c60412b8b17f"><head>Physical Characteristics and Technical Requirements</head><p>Color, Sound</p><p>Duration: 60 minutes</p><p>Original format: MiniDV</p></phystech><scopecontent id="aspace_696a8e56472d48eabb23444ee0edc9d1"><head>Scope and Contents</head><p>Content warning: this recording contains pornographic content.</p></scopecontent></c><c id="aspace_c8eb4c9863479ddff2a7560ddd4a9ce4" level="item"><did><unittitle>Gay USA "That's a Family" Directors Q &amp; A</unittitle><unitid>426.5999</unitid><unitdate datechar="creation" normal="2000/2001" type="inclusive">2000-2001</unitdate><container altrender="Record carton" id="aspace_cb260205b5785a125d7ed046dc0ae46a" label="Moving Images [31142063429529]" type="Box">10</container><container parent="aspace_cb260205b5785a125d7ed046dc0ae46a" type="Media">ID: 426.5999</container><dao xlink:actuate="onRequest" xlink:href="https://hdl.handle.net/2333.1/f7m0cq57" xlink:role="video-service" xlink:show="new" xlink:title="Gay USA &quot;That's a Family&quot; Directors Q &amp; A" xlink:type="simple"><daodesc><p>Gay USA "That's a Family" Directors Q &amp; A: 2000-2001</p></daodesc></dao></did><phystech id="aspace_2280171c3698cb05932008c3bf0fa23a"><head>Physical Characteristics and Technical Requirements</head><p>Color, Sound</p><p>Duration: 34 minutes</p><p>Original format: MiniDV</p></phystech></c><c id="aspace_1da19345eb8d93531b450c78a883bc20" level="item"><did><unittitle>Gay USA Stonewall Halloween 2000</unittitle><unitid>426.6000</unitid><physdesc altrender="whole"><extent altrender="materialtype spaceoccupied">1 media elements</extent><extent altrender="carrier">Mini DV</extent></physdesc><unitdate datechar="creation" normal="2000/2001" type="inclusive">2000-2001</unitdate><container altrender="Record carton" id="aspace_ce3cd6fbf7911c787c3e9001dc60f91c" label="Moving Images [31142063429529]" type="Box">10</container><container parent="aspace_ce3cd6fbf7911c787c3e9001dc60f91c" type="Media">ID: 426.6000</container><dao xlink:actuate="onRequest" xlink:href="https://hdl.handle.net/2333.1/9ghx3pns" xlink:role="video-service" xlink:show="new" xlink:title="Gay USA Stonewall Halloween 2000" xlink:type="simple"><daodesc><p>Gay USA Stonewall Halloween 2000: 2000-2001</p></daodesc></dao></did><phystech id="aspace_b71c5c5f0db66c32c05c780005c70161"><head>Physical Characteristics and Technical Requirements</head><p>Color, Sound</p><p>Duration: 30:57</p><p>Original format: MiniDV</p></phystech></c><c id="aspace_6addac5b432a83fdd27c2991c3236ff9" level="item"><did><unittitle>Gay USA 04/19/2000 Mark Schoofs Interview</unittitle><unitid>426.5986</unitid><unitdate datechar="creation" normal="2000-04-19/2000-04-19" type="inclusive">2000-04-19</unitdate><container altrender="Record carton" id="aspace_69a03430040cba5c3b205a3ac1a94c24" label="Moving Images [31142063429529]" type="Box">10</container><container parent="aspace_69a03430040cba5c3b205a3ac1a94c24" type="Media">ID: 426.5986</container><dao xlink:actuate="onRequest" xlink:href="https://hdl.handle.net/2333.1/g79cnxgn" xlink:role="video-service" xlink:show="new" xlink:title="Gay USA 04/19/2000 Mark Schoofs Interview" xlink:type="simple"><daodesc><p>Gay USA 04/19/2000 Mark Schoofs Interview: 2000-04-19</p></daodesc></dao></did><phystech id="aspace_4507e36a66dcbd0c32d46924b1401080"><head>Physical Characteristics and Technical Requirements</head><p>Color, Sound	</p><p>Duration: 60 minutes</p><p>Original format: MiniDV</p></phystech></c><c id="aspace_c16fff9d551636a86e627c69b47913cb" level="item"><did><unittitle>Gay USA 07/22/2000 Gay Les Awards</unittitle><unitid>426.5987</unitid><unitdate datechar="creation" normal="2000-06-22/2000-06-22" type="inclusive">2000-06-22</unitdate><container altrender="Record carton" id="aspace_18e723e49282d560ba73f3108ee2711a" label="Moving Images [31142063429529]" type="Box">10</container><container parent="aspace_18e723e49282d560ba73f3108ee2711a" type="Media">ID: 426.5987</container><dao xlink:actuate="onRequest" xlink:href="https://hdl.handle.net/2333.1/bg79cwx2" xlink:role="video-service" xlink:show="new" xlink:title="Gay USA 07/22/2000 Gay Les Awards" xlink:type="simple"><daodesc><p>Gay USA 07/22/2000 Gay Les Awards: 2000-06-22</p></daodesc></dao></did><phystech id="aspace_e822aa085e91fedb47071ec73408a83b"><head>Physical Characteristics and Technical Requirements</head><p>Color, Sound	</p><p>Duration: 60 minutes</p><p>Original format: MiniDV</p></phystech></c><c id="aspace_35badd7e470f121b7c92b0c284a53459" level="item"><did><unittitle>Gay USA 06/25/2000 Pier Dance 1 of 2</unittitle><unitid>426.5985</unitid><unitdate datechar="creation" normal="2000-06-25/2000-06-25" type="inclusive">2000-06-25</unitdate><container altrender="Record carton" id="aspace_5051511ac026d304dd3f04ea3969140d" label="Moving Images [31142063429529]" type="Box">10</container><container parent="aspace_5051511ac026d304dd3f04ea3969140d" type="Media">ID: 426.5985</container><dao xlink:actuate="onRequest" xlink:href="https://hdl.handle.net/2333.1/m0cfxz00" xlink:role="video-service" xlink:show="new" xlink:title="Gay USA 06/25/2000 Pier Dance 1 of 2" xlink:type="simple"><daodesc><p>Gay USA 06/25/2000 Pier Dance 1 of 2: 2000-06-25</p></daodesc></dao></did><phystech id="aspace_e705310eef59127bec6f8455452b1447"><head>Physical Characteristics and Technical Requirements</head><p>Color, Sound</p><p>Duration: 60 minutes</p><p>Original format: MiniDV</p></phystech></c><c id="aspace_4b24bf1f1ae3f0696d7f513ce07eeebd" level="item"><did><unittitle>Gay USA 06/25/2000 Pier Dance 2 of 2</unittitle><unitid>426.5993</unitid><unitdate datechar="creation" normal="2000-06-25/2000-06-25" type="inclusive">2000-06-25</unitdate><container altrender="Record carton" id="aspace_4a5f4ddc7fcffb1cdf801f5c3617158a" label="Moving Images [31142063429529]" type="Box">10</container><container parent="aspace_4a5f4ddc7fcffb1cdf801f5c3617158a" type="Media">ID: 426.5993</container><dao xlink:actuate="onRequest" xlink:href="https://hdl.handle.net/2333.1/tht76rqz" xlink:role="video-service" xlink:show="new" xlink:title="Gay USA 06/25/2000 Pier Dance 2 of 2" xlink:type="simple"><daodesc><p>Gay USA 06/25/2000 Pier Dance 2 of 2: 2000-06-25</p></daodesc></dao></did><phystech id="aspace_449ba937bb58f923979a9c1bf9c5410d"><head>Physical Characteristics and Technical Requirements</head><p>Color, Sound</p><p>Duration: 60 minutes</p><p>Original format: MiniDV</p></phystech></c><c id="aspace_08dce46ad6244c44e2dada5db209c706" level="item"><did><unittitle>Gay USA 9/10/2000, Broadway Cares 1 of 2</unittitle><unitid>426.5991</unitid><unitdate datechar="creation" normal="2000-09-10/2000-09-10" type="inclusive">2000-09-10</unitdate><container altrender="Record carton" id="aspace_4d5c8b74795e74000d057ce9038629a0" label="Moving Images [31142063429529]" type="Box">10</container><container parent="aspace_4d5c8b74795e74000d057ce9038629a0" type="Media">ID: 426.5991</container><dao xlink:actuate="onRequest" xlink:href="https://hdl.handle.net/2333.1/31zcrsj0" xlink:role="video-service" xlink:show="new" xlink:title="Gay USA 9/10/2000, Broadway Cares 1 of 2" xlink:type="simple"><daodesc><p>Gay USA 9/10/2000, Broadway Cares 1 of 2: 2000-09-10</p></daodesc></dao></did><phystech id="aspace_a2dc9e7eeec4a964e878d63a926d3ba2"><head>Physical Characteristics and Technical Requirements</head><p>Color, Sound	</p><p>Duration: 60 minutes</p><p>Original format: MiniDV</p></phystech></c><c id="aspace_87600d860bf03a23407edf510eb6811c" level="item"><did><unittitle>Gay USA 09/12/2000, Broadway Cares Equity 2 of 2</unittitle><unitid>426.5992</unitid><unitdate datechar="creation" normal="2000-09-12/2000-09-12" type="inclusive">2000-09-12</unitdate><container altrender="Record carton" id="aspace_328fa40bc7e05867897a2776917bca9b" label="Moving Images [31142063429529]" type="Box">10</container><container parent="aspace_328fa40bc7e05867897a2776917bca9b" type="Media">ID: 426.5992</container><dao xlink:actuate="onRequest" xlink:href="https://hdl.handle.net/2333.1/z8w9gs79" xlink:role="video-service" xlink:show="new" xlink:title="Gay USA 09/12/2000, Broadway Cares Equity 2 of 2" xlink:type="simple"><daodesc><p>Gay USA 09/12/2000, Broadway Cares Equity 2 of 2: 2000-09-12</p></daodesc></dao></did><phystech id="aspace_9eabcba848615ffbf16871e76da01d3e"><head>Physical Characteristics and Technical Requirements</head><p>Color, Sound</p><p>Duration: 60 minutes</p><p>Original format: MiniDV</p></phystech></c><c id="aspace_94377947f34de19693f40fcde9d4f256" level="item"><did><unittitle>Gay USA 2000 Black Party</unittitle><unitid>426.5990</unitid><unitdate datechar="creation" normal="2000/2000" type="inclusive">2000</unitdate><container altrender="Record carton" id="aspace_d60a690d41c1ded066593021962ca076" label="Moving Images [31142063429529]" type="Box">10</container><container parent="aspace_d60a690d41c1ded066593021962ca076" type="Media">ID: 426.5990</container><dao xlink:actuate="onRequest" xlink:href="https://hdl.handle.net/2333.1/material-request-placeholder" xlink:role="video-reading-room" xlink:show="new" xlink:title="Gay USA 2000 Black Party" xlink:type="simple"><daodesc><p>Gay USA 2000 Black Party: 2000</p></daodesc></dao></did><phystech id="aspace_d70df0755f6af82591a00e5c039bd709"><head>Physical Characteristics and Technical Requirements</head><p>Color, Sound</p><p>Duration: 60 minutes</p><p>Original format: MiniDV</p></phystech><scopecontent id="aspace_7b1178dc7447b1bc0e377d4fd00a32a9"><head>Scope and Contents</head><p>Content warning: this recording contains pornographic content.</p></scopecontent></c><c id="aspace_506f57c2f328452b24cf3ec3dc0ca2d9" level="item"><did><unittitle>Gay USA 2000 Sex Acts Black Party</unittitle><unitid>426.5989</unitid><unitdate datechar="creation" normal="2000/2000" type="inclusive">2000</unitdate><container altrender="Record carton" id="aspace_fb16ba24eda470e2053fdc357edef021" label="Moving Images [31142063429529]" type="Box">10</container><container parent="aspace_fb16ba24eda470e2053fdc357edef021" type="Media">ID: 426.5989</container><dao xlink:actuate="onRequest" xlink:href="https://hdl.handle.net/2333.1/material-request-placeholder" xlink:role="video-reading-room" xlink:show="new" xlink:title="Gay USA 2000 Sex Acts Black Party" xlink:type="simple"><daodesc><p>Gay USA 2000 Sex Acts Black Party: 2000</p></daodesc></dao></did><phystech id="aspace_d788c4e1051439cbb2f6272c67b7e425"><head>Physical Characteristics and Technical Requirements</head><p>Color, Sound</p><p>Duration: 60 minutes</p><p>Original format: MiniDV</p></phystech><scopecontent id="aspace_b7198f3f42fce8a10fdc6a4da610d744"><head>Scope and Contents</head><p>Content warning: this recording contains pornographic content.</p></scopecontent></c><c id="aspace_433f853bd45f5a72b3948625d3a07253" level="item"><did><unittitle>Gay USA 1965-2000 Brad Harryman</unittitle><unitid>426.5988</unitid><unitdate datechar="creation" normal="1965/2000" type="inclusive">1965-2000</unitdate><container altrender="Record carton" id="aspace_91816d533ba0ca53560fedf8751c7d03" label="Moving Images [31142063429529]" type="Box">10</container><container parent="aspace_91816d533ba0ca53560fedf8751c7d03" type="Media">ID: 426.5988</container><dao xlink:actuate="onRequest" xlink:href="https://hdl.handle.net/2333.1/6q573wdx" xlink:role="video-service" xlink:show="new" xlink:title="Gay USA 1965-2000 Brad Harryman" xlink:type="simple"><daodesc><p>Gay USA 1965-2000 Brad Harryman: 1965-2000</p></daodesc></dao></did><phystech id="aspace_86c222cb0c2bce81ffd8e8b80b290f43"><head>Physical Characteristics and Technical Requirements</head><p>Color, sound	</p><p>Duration: 60 minutes</p><p>Original format: MiniDV</p></phystech></c><c id="aspace_bfe6d0ef2e13b0dd70617715f8e0893b" level="item"><did><unittitle>Gay USA 03/23/2001 Tom of Finland Party</unittitle><unitid>426.5983</unitid><unitdate datechar="creation" normal="2001-03-23/2001-03-23" type="inclusive">2001-03-23</unitdate><container altrender="Record carton" id="aspace_5a157075f9c696ae6e37154ef20e979e" label="Moving Images [31142063429529]" type="Box">10</container><container parent="aspace_5a157075f9c696ae6e37154ef20e979e" type="Media">ID: 426.5983</container><dao xlink:actuate="onRequest" xlink:href="https://hdl.handle.net/2333.1/material-request-placeholder" xlink:role="video-reading-room" xlink:show="new" xlink:title="Gay USA 03/23/2001 Tom of Finland Party" xlink:type="simple"><daodesc><p>Gay USA 03/23/2001 Tom of Finland Party: 2001-03-23</p></daodesc></dao></did><phystech id="aspace_75a33b2c7aa0fbeb5816f8c89d2863db"><head>Physical Characteristics and Technical Requirements</head><p>Color, Sound</p><p>Duration: 60 minutes</p><p>Original format: MiniDV</p></phystech><scopecontent id="aspace_3c2ff8b8a9d4dead5f26e8eeef6498f8"><head>Scope and Contents</head><p>Content warning: this recording contains pornographic content.</p></scopecontent></c><c id="aspace_f9ebd871c5083a4530e0115141a94a48" level="item"><did><unittitle>Gay USA 05/21/2001 Destination Groove at Limelight 1 of 3</unittitle><unitid>426.5994</unitid><unitdate datechar="creation" normal="2001-05-21/2001-05-21" type="inclusive">2001-05-21</unitdate><container altrender="Record carton" id="aspace_63539ac132952ebfafd0261de06597da" label="Moving Images [31142063429529]" type="Box">10</container><container parent="aspace_63539ac132952ebfafd0261de06597da" type="Media">ID: 426.5994</container><dao xlink:actuate="onRequest" xlink:href="https://hdl.handle.net/2333.1/prr4xr6p" xlink:role="video-service" xlink:show="new" xlink:title="Gay USA 05/21/2001 Destination Groove at Limelight 1 of 3" xlink:type="simple"><daodesc><p>Gay USA 05/21/2001 Destination Groove at Limelight 1 of 3: 2001-05-21</p></daodesc></dao></did><phystech id="aspace_e9ea79ff52f4138d0e0a110787ba26da"><head>Physical Characteristics and Technical Requirements</head><p>Color, Sound	</p><p>Duration: 60 minutes</p><p>Original format: MiniDV</p></phystech></c><c id="aspace_c34f5fb4508c29166836f67faf61d9ed" level="item"><did><unittitle>Gay USA 05/21/2001 Destination Groove at Limelight 2 of 3</unittitle><unitid>426.5995</unitid><unitdate datechar="creation" normal="2001-05-21/2001-05-21" type="inclusive">2001-05-21</unitdate><container altrender="Record carton" id="aspace_9a8da67926537d63ff60edfda110f2e3" label="Moving Images [31142063429529]" type="Box">10</container><container parent="aspace_9a8da67926537d63ff60edfda110f2e3" type="Media">ID: 426.5995</container><dao xlink:actuate="onRequest" xlink:href="https://hdl.handle.net/2333.1/k0p2nqpc" xlink:role="video-service" xlink:show="new" xlink:title="Gay USA 05/21/2001 Destination Groove at Limelight 2 of 3" xlink:type="simple"><daodesc><p>Gay USA 05/21/2001 Destination Groove at Limelight 2 of 3: 2001-05-21</p></daodesc></dao></did><phystech id="aspace_bb2b97245ffd8ab4b2b9747dc8b7bcbb"><head>Physical Characteristics and Technical Requirements</head><p>Color, Sound</p><p>Duration: 60 minutes'</p><p>Original format: MiniDV</p></phystech></c><c id="aspace_ab061fa3e3be4a8aa5dbb2f9f029e781" level="item"><did><unittitle>Gay USA 05/24/2001</unittitle><unitid>426.5979</unitid><unitdate datechar="creation" normal="2001-05-24/2001-05-24" type="inclusive">2001-05-24</unitdate><container altrender="Record carton" id="aspace_7b02c3e204840dac208384118e58c545" label="Moving Images [31142063429529]" type="Box">10</container><container parent="aspace_7b02c3e204840dac208384118e58c545" type="Media">ID: 426.5979</container><dao xlink:actuate="onRequest" xlink:href="https://hdl.handle.net/2333.1/3xsj433k" xlink:role="video-service" xlink:show="new" xlink:title="Gay USA 05/24/2001" xlink:type="simple"><daodesc><p>Gay USA 05/24/2001: 2001-05-24</p></daodesc></dao></did><phystech id="aspace_e20893859fbeb0f00b1f59de89dc6957"><head>Physical Characteristics and Technical Requirements</head><p>Color, Sound</p><p>Duration: 60 Minutes</p><p>Original format: 3/4" U-matic</p></phystech></c><c id="aspace_fcf654b50ee53bd1d24c4787337e9296" level="item"><did><unittitle>Gay USA 06/21/2001</unittitle><unitid>426.5976</unitid><unitdate datechar="creation" normal="2001-06-21/2001-06-21" type="inclusive">2001-06-21</unitdate><container altrender="Record carton" id="aspace_c38fd648d3b05a54036f6372cf7dee29" label="Moving Images [31142063429529]" type="Box">10</container><container parent="aspace_c38fd648d3b05a54036f6372cf7dee29" type="Media">ID: 426.5976</container><dao xlink:actuate="onRequest" xlink:href="https://hdl.handle.net/2333.1/h70rz4n8" xlink:role="video-service" xlink:show="new" xlink:title="Gay USA 06/21/2001" xlink:type="simple"><daodesc><p>Gay USA 06/21/2001: 2001-06-21</p></daodesc></dao></did><phystech id="aspace_71ceb7aa263c344f78f6020d8a4e30ae"><head>Physical Characteristics and Technical Requirements</head><p>Content: Color, Sound</p><p>Duration: 60 Minutes</p><p>Original format: 3/4" U-matic</p></phystech></c><c id="aspace_391bd7a0f6a01e19607a7db685c77182" level="item"><did><unittitle>Gay USA 06/23/2001 Caligula</unittitle><unitid>426.5984</unitid><unitdate datechar="creation" normal="2001-06-23/2001-06-23" type="inclusive">2001-06-23</unitdate><container altrender="Record carton" id="aspace_c3bd40b592013db69a531c61e31ae5d8" label="Moving Images [31142063429529]" type="Box">10</container><container parent="aspace_c3bd40b592013db69a531c61e31ae5d8" type="Media">ID: 426.5984</container><dao xlink:actuate="onRequest" xlink:href="https://hdl.handle.net/2333.1/v9s4n7pz" xlink:role="video-service" xlink:show="new" xlink:title="Gay USA 06/23/2001 Caligula" xlink:type="simple"><daodesc><p>Gay USA 06/23/2001 Caligula: 2001-06-23</p></daodesc></dao></did><phystech id="aspace_2c70d2e7b92b09bb0878e841ab788724"><head>Physical Characteristics and Technical Requirements</head><p>Color, Sound	</p><p>Duration: 60 minutes</p><p>Original format: MiniDV</p></phystech></c><c id="aspace_1ab11a608f045568356ec7bb73fb1fe6" level="item"><did><unittitle>Gay USA 07/05/2001</unittitle><unitid>426.5981</unitid><unitdate datechar="creation" normal="2001-07-05/2001-07-05" type="inclusive">2001-07-05</unitdate><container altrender="Record carton" id="aspace_6c1f2a6e0fc101f9f0a585babce29412" label="Moving Images [31142063429529]" type="Box">10</container><container parent="aspace_6c1f2a6e0fc101f9f0a585babce29412" type="Media">ID: 426.5981</container><dao xlink:actuate="onRequest" xlink:href="https://hdl.handle.net/2333.1/vhhmh00h" xlink:role="video-service" xlink:show="new" xlink:title="Gay USA 07/05/2001" xlink:type="simple"><daodesc><p>Gay USA 07/05/2001: 2001-07-05</p></daodesc></dao></did><phystech id="aspace_3091d9ce12e5c68ed4eee0ffee5755f0"><head>Physical Characteristics and Technical Requirements</head><p>Color, Sound</p><p>Duration: 60 min</p><p>Original format: 3/4" U-matic</p></phystech></c><c id="aspace_cfc8ff9427432d71918555ff1c696b88" level="item"><did><unittitle>Gay USA 07/28/2001</unittitle><unitid>426.5980</unitid><unitdate datechar="creation" normal="2001-07-28/2001-07-28" type="inclusive">2001-07-28</unitdate><container altrender="Record carton" id="aspace_43e33837cee4ece40f9650e2bf90d928" label="Moving Images [31142063429529]" type="Box">10</container><container parent="aspace_43e33837cee4ece40f9650e2bf90d928" type="Media">ID: 426.5980</container><dao xlink:actuate="onRequest" xlink:href="https://hdl.handle.net/2333.1/08kps096" xlink:role="video-service" xlink:show="new" xlink:title="Gay USA 07/28/2001" xlink:type="simple"><daodesc><p>Gay USA 07/28/2001: 2001-07-28</p></daodesc></dao></did><phystech id="aspace_59921abc4b7e635248a6914658656caf"><head>Physical Characteristics and Technical Requirements</head><p>color, sound</p><p>Duration: 60 min</p><p>Original format: 3/4" U-matic</p></phystech></c><c id="aspace_cbb08a8b7f4b436ca86951b344a9bb6d" level="item"><did><unittitle>Gay USA 08/09/2001</unittitle><unitid>426.5978</unitid><unitdate datechar="creation" normal="2001-08-09/2001-08-09" type="inclusive">2001-08-09</unitdate><container altrender="Record carton" id="aspace_e8312d2e5d28e7dfdf2fa621163e258e" label="Moving Images [31142063429529]" type="Box">10</container><container parent="aspace_e8312d2e5d28e7dfdf2fa621163e258e" type="Media">ID: 426.5978</container><dao xlink:actuate="onRequest" xlink:href="https://hdl.handle.net/2333.1/7pvmd3mq" xlink:role="video-service" xlink:show="new" xlink:title="Gay USA 08/09/2001" xlink:type="simple"><daodesc><p>Gay USA 08/09/2001: 2001-08-09</p></daodesc></dao></did><phystech id="aspace_67f1fb76282d6e743eb8d30fd72660e9"><head>Physical Characteristics and Technical Requirements</head><p>Color,sound </p><p>Duration: 60 min</p><p>Original format: 3/4" U-matic</p></phystech></c><c id="aspace_f578898982be81278152e2e51fc8f243" level="item"><did><unittitle>Gay USA 08/16/2001</unittitle><unitid>426.5977</unitid><unitdate datechar="creation" normal="2001-08-16/2001-08-16" type="inclusive">2001-08-16</unitdate><container altrender="Record carton" id="aspace_d59d454272c68e9638b5bafd927b3cec" label="Moving Images [31142063429529]" type="Box">10</container><container parent="aspace_d59d454272c68e9638b5bafd927b3cec" type="Media">ID: 426.5977</container><dao xlink:actuate="onRequest" xlink:href="https://hdl.handle.net/2333.1/cfxpp442" xlink:role="video-service" xlink:show="new" xlink:title="Gay USA 08/16/2001" xlink:type="simple"><daodesc><p>Gay USA 08/16/2001: 2001-08-16</p></daodesc></dao></did><phystech id="aspace_66738de3acdd9681cc7f25b4a2347098"><head>Physical Characteristics and Technical Requirements</head><p>Color, Sound</p><p>Duration: 60 min</p><p>Original Format: 3/4" U-Matic</p></phystech></c><c id="aspace_d98547429cfc7ccee5b556e641628a19" level="item"><did><unittitle>Gay USA 08/23/2001</unittitle><unitid>426.5982</unitid><unitdate datechar="creation" normal="2001-08-23/2001-08-23" type="inclusive">2001-08-23</unitdate><container altrender="Record carton" id="aspace_076c33a73cfffa7f4cdedbe27f132c4b" label="Moving Images [31142063429529]" type="Box">10</container><container parent="aspace_076c33a73cfffa7f4cdedbe27f132c4b" type="Media">ID: 426.5982</container><dao xlink:actuate="onRequest" xlink:href="https://hdl.handle.net/2333.1/qrfj6zg0" xlink:role="video-service" xlink:show="new" xlink:title="Gay USA 08/23/2001" xlink:type="simple"><daodesc><p>Gay USA 08/23/2001: 2001-08-23</p></daodesc></dao></did><phystech id="aspace_3c71a26f712560b707b245cc4576bacc"><head>Physical Characteristics and Technical Requirements</head><p>Color, Sound</p><p>Duration: 60 min</p><p>Original Format: 3/4" Umatic</p></phystech></c><c id="aspace_ref3" level="item"><did><unittitle>Gay USA 9/2/2002 - Rally</unittitle><unitid>ID: 426.0001</unitid><physdesc altrender="whole"><extent altrender="materialtype spaceoccupied">1 media elements</extent><extent altrender="carrier">DVCAM</extent></physdesc><unitdate datechar="creation" normal="2002/2002" type="inclusive">September 2, 2002</unitdate><container altrender="Record carton" id="aspace_5dcd981ca1e7d6c8eee29d511e7595e6" label="Moving Images [31142063429305]" type="Box">1</container><container parent="aspace_5dcd981ca1e7d6c8eee29d511e7595e6" type="Media">ID: 426.0001</container><dao xlink:actuate="onRequest" xlink:href="https://hdl.handle.net/2333.1/fj6q5ffr" xlink:role="video-service" xlink:show="new" xlink:title="Gay USA 9/2/2002 - Rally" xlink:type="simple"><daodesc><p>Gay USA 9/2/2002 - Rally: September 2, 2002</p></daodesc></dao></did><phystech id="aspace_846653f58d3ea93c6f117ee4f28533dd"><head>Physical Characteristics and Technical Requirements</head><p>Color, sound</p><p>Duration: 60 minutes</p><p>Original format: DVCAM</p></phystech></c><c id="aspace_ref6" level="item"><did><unittitle>Gay USA 9/26/2002</unittitle><unitid>ID: 426.0002</unitid><physdesc altrender="whole"><extent altrender="materialtype spaceoccupied">1 media elements</extent><extent altrender="carrier">DVCAM</extent></physdesc><unitdate datechar="creation" normal="2002/2002" type="inclusive">September 26, 2002</unitdate><container altrender="Record carton" id="aspace_b53b0d1e020ae703aa0a89db6b555408" label="Moving Images [31142063429305]" type="Box">1</container><container parent="aspace_b53b0d1e020ae703aa0a89db6b555408" type="Media">ID: 426.0002</container><dao xlink:actuate="onRequest" xlink:href="https://hdl.handle.net/2333.1/9w0vtbnb" xlink:role="video-service" xlink:show="new" xlink:title="Gay USA 9/26/2002" xlink:type="simple"><daodesc><p>Gay USA 9/26/2002: September 26, 2002</p></daodesc></dao></did><phystech id="aspace_1e75b0e865545c418f29460af12d7b96"><head>Physical Characteristics and Technical Requirements</head><p>Color, sound</p><p>Duration: 60 minutes</p><p>Original format: DVCAM</p></phystech></c><c id="aspace_ref9" level="item"><did><unittitle>Gay USA 10/3/2002</unittitle><unitid>ID: 426.0003</unitid><physdesc altrender="whole"><extent altrender="materialtype spaceoccupied">1 media elements</extent><extent altrender="carrier">DVCAM</extent></physdesc><unitdate datechar="creation" normal="2002/2002" type="inclusive">October 3, 2002</unitdate><container altrender="Record carton" id="aspace_758f760f9348b83b136fd1ee1a087853" label="Moving Images [31142063429305]" type="Box">1</container><container parent="aspace_758f760f9348b83b136fd1ee1a087853" type="Media">ID: 426.0003</container><dao xlink:actuate="onRequest" xlink:href="https://hdl.handle.net/2333.1/63xsjb45" xlink:role="video-service" xlink:show="new" xlink:title="Gay USA 10/3/2002" xlink:type="simple"><daodesc><p>Gay USA 10/3/2002: October 3, 2002</p></daodesc></dao></did><phystech id="aspace_dab37487a16bbcb93171e0c32b2b2418"><head>Physical Characteristics and Technical Requirements</head><p>Color, sound</p><p>Duration: 60 minutes</p><p>Original Format: DVCAM</p></phystech></c><c id="aspace_ref12" level="item"><did><unittitle>Gay USA 10/10/2002</unittitle><unitid>ID: 426.0004</unitid><physdesc altrender="whole"><extent altrender="materialtype spaceoccupied">1 media elements</extent><extent altrender="carrier">DVCAM</extent></physdesc><unitdate datechar="creation" normal="2002/2002" type="inclusive">October 10, 2002</unitdate><container altrender="Record carton" id="aspace_d854870d6d0c7608d2e4bf36b554fffd" label="Moving Images [31142063429305]" type="Box">1</container><container parent="aspace_d854870d6d0c7608d2e4bf36b554fffd" type="Media">ID: 426.0004</container><dao xlink:actuate="onRequest" xlink:href="https://hdl.handle.net/2333.1/2bvq89mt" xlink:role="video-service" xlink:show="new" xlink:title="Gay USA 10/10/2002" xlink:type="simple"><daodesc><p>Gay USA 10/10/2002: October 10, 2002</p></daodesc></dao></did><phystech id="aspace_ca2aefbcd7aa32d5bdddb2bf0371364c"><head>Physical Characteristics and Technical Requirements</head><p>Color, sound</p><p>Duration: 60 minutes</p><p>Original format: DVCAM</p></phystech></c><c id="aspace_ref15" level="item"><did><unittitle>Gay USA 10/17/2002</unittitle><unitid>ID: 426.0005</unitid><physdesc altrender="whole"><extent altrender="materialtype spaceoccupied">1 media elements</extent><extent altrender="carrier">DVCAM</extent></physdesc><unitdate datechar="creation" normal="2002/2002" type="inclusive">October 17, 2002</unitdate><container altrender="Record carton" id="aspace_c40fd5619cb5efb64eea3b8c5fcf444d" label="Moving Images [31142063429305]" type="Box">1</container><container parent="aspace_c40fd5619cb5efb64eea3b8c5fcf444d" type="Media">ID: 426.0005</container><dao xlink:actuate="onRequest" xlink:href="https://hdl.handle.net/2333.1/xksn098w" xlink:role="video-service" xlink:show="new" xlink:title="Gay USA 10/17/2002" xlink:type="simple"><daodesc><p>Gay USA 10/17/2002: October 17, 2002</p></daodesc></dao></did><phystech id="aspace_717d1ae6d840ef1494c31c54605504fc"><head>Physical Characteristics and Technical Requirements</head><p>Color, sound</p><p>Duration: 60 minutes</p><p>Original format: DVCAM</p></phystech></c><c id="aspace_ref16" level="item"><did><unittitle>Gay USA 10/11/2002</unittitle><unitid>ID: 426.0006</unitid><physdesc altrender="whole"><extent altrender="materialtype spaceoccupied">1 media elements</extent><extent altrender="carrier">DVCAM</extent></physdesc><unitdate datechar="creation" normal="2002/2002" type="inclusive">October 11, 2002</unitdate><container altrender="Record carton" id="aspace_a736c4283200fff752394718ab097fe3" label="Moving Images [31142063429305]" type="Box">1</container><container parent="aspace_a736c4283200fff752394718ab097fe3" type="Media">ID: 426.0006</container></did><phystech id="aspace_ef195b8628421365527b878f82db1919"><head>Physical Characteristics and Technical Requirements</head><p>Color, sound</p><p>Duration: 60 minutes</p><p>Original format: DVCAM</p></phystech></c><c id="aspace_ref17" level="item"><did><unittitle>Gay USA 10/31/2002</unittitle><unitid>ID: 426.0007</unitid><physdesc altrender="whole"><extent altrender="materialtype spaceoccupied">1 media elements</extent><extent altrender="carrier">DVCAM</extent></physdesc><unitdate datechar="creation" normal="2002/2002" type="inclusive">October 31, 2002</unitdate><container altrender="Record carton" id="aspace_027b9a307ed1904219eb5140949dcf2a" label="Moving Images [31142063429305]" type="Box">1</container><container parent="aspace_027b9a307ed1904219eb5140949dcf2a" type="Media">ID: 426.0007</container><dao xlink:actuate="onRequest" xlink:href="https://hdl.handle.net/2333.1/stqjq8rd" xlink:role="video-service" xlink:show="new" xlink:title="Gay USA 10/31/2002" xlink:type="simple"><daodesc><p>Gay USA 10/31/2002: October 31, 2002</p></daodesc></dao></did><phystech id="aspace_955e680572af9802cc993c6297c77019"><head>Physical Characteristics and Technical Requirements</head><p>Color, sound</p><p>Duration: 60 minutes</p><p>Original format: DVCAM</p></phystech></c><c id="aspace_ref24" level="item"><did><unittitle>Gay USA 11/07/2002</unittitle><unitid>ID: 426.0008</unitid><physdesc altrender="whole"><extent altrender="materialtype spaceoccupied">1 media elements</extent><extent altrender="carrier">DVCAM</extent></physdesc><unitdate datechar="creation" normal="2002/2002" type="inclusive">November 7, 2002</unitdate><container altrender="Record carton" id="aspace_754da2d7f4efd7d4d1f36f79a5f95067" label="Moving Images [31142063429305]" type="Box">1</container><container parent="aspace_754da2d7f4efd7d4d1f36f79a5f95067" type="Media">ID: 426.0008</container><dao xlink:actuate="onRequest" xlink:href="https://hdl.handle.net/2333.1/p2ngf879" xlink:role="video-service" xlink:show="new" xlink:title="Gay USA 11/07/2002" xlink:type="simple"><daodesc><p>Gay USA 11/07/2002: November 7, 2002</p></daodesc></dao></did><phystech id="aspace_7f765cdeea4517ffe2dc71b48552f86b"><head>Physical Characteristics and Technical Requirements</head><p>Color, sound</p><p>Duration: 60 minutes</p><p>Original format: DVCAM</p></phystech></c><c id="aspace_ref27" level="item"><did><unittitle>Gay USA 11/14/2002</unittitle><unitid>ID: 426.0009</unitid><physdesc altrender="whole"><extent altrender="materialtype spaceoccupied">1 media elements</extent><extent altrender="carrier">DVCAM</extent></physdesc><unitdate datechar="creation" normal="2002/2002" type="inclusive">November 14, 2002</unitdate><container altrender="Record carton" id="aspace_dbbfd8013a6bf86f8ba93052f010f25d" label="Moving Images [31142063429305]" type="Box">1</container><container parent="aspace_dbbfd8013a6bf86f8ba93052f010f25d" type="Media">ID: 426.0009</container><dao xlink:actuate="onRequest" xlink:href="https://hdl.handle.net/2333.1/j9kd57qz" xlink:role="video-service" xlink:show="new" xlink:title="Gay USA 11/14/2002" xlink:type="simple"><daodesc><p>Gay USA 11/14/2002: November 14, 2002</p></daodesc></dao></did><phystech id="aspace_fb6aa1bdb235d444f28dc34f3f600061"><head>Physical Characteristics and Technical Requirements</head><p>Color, sound</p><p>Duration: 60 minutes</p><p>Original format: DVCAM</p></phystech></c><c id="aspace_ref30" level="item"><did><unittitle>Gay USA 11/20/2002 - Cued to first frame of Black - please time from here! (don't rewind)</unittitle><unitid>ID: 426.0010</unitid><physdesc altrender="whole"><extent altrender="materialtype spaceoccupied">1 media elements</extent><extent altrender="carrier">DVCAM</extent></physdesc><unitdate datechar="creation" normal="2002/2002" type="inclusive">November 20, 2002</unitdate><container altrender="Record carton" id="aspace_c147f70303e1b1e2ce63f8f5f1cc6a92" label="Moving Images [31142063429305]" type="Box">1</container><container parent="aspace_c147f70303e1b1e2ce63f8f5f1cc6a92" type="Media">ID: 426.0010</container><dao xlink:actuate="onRequest" xlink:href="https://hdl.handle.net/2333.1/dncjt4w9" xlink:role="video-service" xlink:show="new" xlink:title="Gay USA 11/20/2002 - Cued to first frame of Black - please time from here! (don't rewind)" xlink:type="simple"><daodesc><p>Gay USA 11/20/2002 - Cued to first frame of Black - please time from here! (don't rewind): November 20, 2002</p></daodesc></dao></did><phystech id="aspace_8617517353529a11f44b0101feb4d7c5"><head>Physical Characteristics and Technical Requirements</head><p>Color, sound</p><p>Duration: 60 minutes</p><p>Original format: DVCAM</p></phystech></c><c id="aspace_ref33" level="item"><did><unittitle>Gay USA 11/28/2002</unittitle><unitid>ID: 426.0011</unitid><physdesc altrender="whole"><extent altrender="materialtype spaceoccupied">1 media elements</extent><extent altrender="carrier">DVCAM</extent></physdesc><unitdate datechar="creation" normal="2002/2002" type="inclusive">November 28, 2002</unitdate><container altrender="Record carton" id="aspace_8df7ee1fb9b4bce435f7d363ddffe2e0" label="Moving Images [31142063429305]" type="Box">1</container><container parent="aspace_8df7ee1fb9b4bce435f7d363ddffe2e0" type="Media">ID: 426.0011</container><dao xlink:actuate="onRequest" xlink:href="https://hdl.handle.net/2333.1/8w9gj4c5" xlink:role="video-service" xlink:show="new" xlink:title="Gay USA 11/28/2002" xlink:type="simple"><daodesc><p>Gay USA 11/28/2002: November 28, 2002</p></daodesc></dao></did><phystech id="aspace_8b13ba1d432bebd0f3634b0f3efcbbf8"><head>Physical Characteristics and Technical Requirements</head><p>Color, sound</p><p>Duration: 60 minutes</p><p>Original format: DVCAM</p></phystech></c><c id="aspace_ref36" level="item"><did><unittitle>Gay USA 12/5/2002</unittitle><unitid>ID: 426.0012</unitid><physdesc altrender="whole"><extent altrender="materialtype spaceoccupied">1 media elements</extent><extent altrender="carrier">DVCAM</extent></physdesc><unitdate datechar="creation" normal="2002/2002" type="inclusive">December 5, 2002</unitdate><container altrender="Record carton" id="aspace_91728cbd343bdbbee25551a7c209afd4" label="Moving Images [31142063429305]" type="Box">1</container><container parent="aspace_91728cbd343bdbbee25551a7c209afd4" type="Media">ID: 426.0012</container><dao xlink:actuate="onRequest" xlink:href="https://hdl.handle.net/2333.1/547d83vv" xlink:role="video-service" xlink:show="new" xlink:title="Gay USA 12/5/2002" xlink:type="simple"><daodesc><p>Gay USA 12/5/2002: December 5, 2002</p></daodesc></dao></did><phystech id="aspace_12086c4252d19ecf6a479cecbea55ff3"><head>Physical Characteristics and Technical Requirements</head><p>Color, sound</p><p>Duration: 60 minutes</p><p>Original format: DVCAM</p></phystech></c><c id="aspace_ref39" level="item"><did><unittitle>Gay USA 12/12/2002</unittitle><unitid>ID: 426.0013</unitid><physdesc altrender="whole"><extent altrender="materialtype spaceoccupied">1 media elements</extent><extent altrender="carrier">DVCAM</extent></physdesc><unitdate datechar="creation" normal="2002/2002" type="inclusive">December 12, 2002</unitdate><container altrender="Record carton" id="aspace_f6bb715c63ceb7fac9ed15de34467e45" label="Moving Images [31142063429305]" type="Box">1</container><container parent="aspace_f6bb715c63ceb7fac9ed15de34467e45" type="Media">ID: 426.0013</container><dao xlink:actuate="onRequest" xlink:href="https://hdl.handle.net/2333.1/1c5b03bq" xlink:role="video-service" xlink:show="new" xlink:title="Gay USA 12/12/2002" xlink:type="simple"><daodesc><p>Gay USA 12/12/2002: December 12, 2002</p></daodesc></dao></did><phystech id="aspace_5971ae32dc240580c5a1e9e4b34c8a66"><head>Physical Characteristics and Technical Requirements</head><p>Color, sound</p><p>Duration: 60 minutes</p><p>Original format: DVCAM</p></phystech></c><c id="aspace_ref42" level="item"><did><unittitle>Gay USA 12/19/2002 - No Pre-roll</unittitle><unitid>ID: 426.0014</unitid><physdesc altrender="whole"><extent altrender="materialtype spaceoccupied">1 media elements</extent><extent altrender="carrier">DVCAM</extent></physdesc><unitdate datechar="creation" normal="2002/2002" type="inclusive">December 19, 2002</unitdate><container altrender="Record carton" id="aspace_58cd7676cc1e33ce2e31bc14f46ae63e" label="Moving Images [31142063429305]" type="Box">1</container><container parent="aspace_58cd7676cc1e33ce2e31bc14f46ae63e" type="Media">ID: 426.0014</container><dao xlink:actuate="onRequest" xlink:href="https://hdl.handle.net/2333.1/wm37q31w" xlink:role="video-service" xlink:show="new" xlink:title="Gay USA 12/19/2002 - No Pre-roll" xlink:type="simple"><daodesc><p>Gay USA 12/19/2002 - No Pre-roll: December 19, 2002</p></daodesc></dao></did><phystech id="aspace_121522bc0651e7effb8c5f4f0ab0932c"><head>Physical Characteristics and Technical Requirements</head><p>Color, sound</p><p>Duration: 60 minutes</p><p>Original format: DVCAM</p></phystech></c><c id="aspace_ref43" level="item"><did><unittitle>Gay USA 12/26/2002</unittitle><unitid>ID: 426.0015</unitid><physdesc altrender="whole"><extent altrender="materialtype spaceoccupied">1 media elements</extent><extent altrender="carrier">DVCAM</extent></physdesc><unitdate datechar="creation" normal="2002/2002" type="inclusive">December 26, 2002</unitdate><container altrender="Record carton" id="aspace_66b4d0c644f8e62bfc13e6878f0f86b3" label="Moving Images [31142063429305]" type="Box">1</container><container parent="aspace_66b4d0c644f8e62bfc13e6878f0f86b3" type="Media">ID: 426.0015</container><dao xlink:actuate="onRequest" xlink:href="https://hdl.handle.net/2333.1/rv15f2hj" xlink:role="video-service" xlink:show="new" xlink:title="Gay USA 12/26/2002" xlink:type="simple"><daodesc><p>Gay USA 12/26/2002: December 26, 2002</p></daodesc></dao></did><phystech id="aspace_159de57acdd27f4c4c1c4f2c6f378c0b"><head>Physical Characteristics and Technical Requirements</head><p>Color, sound</p><p>Duration: 60 minutes</p><p>Original format: DVCAM</p></phystech></c><c id="aspace_ref46" level="item"><did><unittitle>Gay USA 1/1/2003</unittitle><unitid>ID: 426.0016</unitid><physdesc altrender="whole"><extent altrender="materialtype spaceoccupied">1 media elements</extent><extent altrender="carrier">DVCAM</extent></physdesc><unitdate datechar="creation" normal="2003/2003" type="inclusive">January 1, 2003</unitdate><container altrender="Record carton" id="aspace_751c13d449a29350f71a9be6a2922a0d" label="Moving Images [31142063429305]" type="Box">1</container><container parent="aspace_751c13d449a29350f71a9be6a2922a0d" type="Media">ID: 426.0016</container><dao xlink:actuate="onRequest" xlink:href="https://hdl.handle.net/2333.1/n2z351zx" xlink:role="video-service" xlink:show="new" xlink:title="Gay USA 1/1/2003" xlink:type="simple"><daodesc><p>Gay USA 1/1/2003: January 1, 2003</p></daodesc></dao></did><phystech id="aspace_215a2cf5e8a764442fc9a2ee3444e714"><head>Physical Characteristics and Technical Requirements</head><p>Color, sound</p><p>Duration: 60 minutes</p><p>Original format: DVCAM</p></phystech></c><c id="aspace_ref49" level="item"><did><unittitle>Gay USA 1/9/2003</unittitle><unitid>ID: 426.0017</unitid><physdesc altrender="whole"><extent altrender="materialtype spaceoccupied">1 media elements</extent><extent altrender="carrier">DVCAM</extent></physdesc><unitdate datechar="creation" normal="2003/2003" type="inclusive">January 9, 2003</unitdate><container altrender="Record carton" id="aspace_fe49945180c31c257b960ee4ed99559e" label="Moving Images [31142063429305]" type="Box">1</container><container parent="aspace_fe49945180c31c257b960ee4ed99559e" type="Media">ID: 426.0017</container><dao xlink:actuate="onRequest" xlink:href="https://hdl.handle.net/2333.1/hdr7sz6s" xlink:role="video-service" xlink:show="new" xlink:title="Gay USA 1/9/2003" xlink:type="simple"><daodesc><p>Gay USA 1/9/2003: January 9, 2003</p></daodesc></dao></did><phystech id="aspace_d35eda89d5c3aa7abc9d0e54ff091f6f"><head>Physical Characteristics and Technical Requirements</head><p>Color, sound</p><p>Duration: 60 minutes</p><p>Original format: DVCAM</p></phystech></c><c id="aspace_ref52" level="item"><did><unittitle>Gay USA 1/16/2003</unittitle><unitid>ID: 426.0018</unitid><physdesc altrender="whole"><extent altrender="materialtype spaceoccupied">1 media elements</extent><extent altrender="carrier">DVCAM</extent></physdesc><unitdate datechar="creation" normal="2003/2003" type="inclusive">January 16, 2003</unitdate><container altrender="Record carton" id="aspace_698559ee8dc5b6bd4cd89f0b516480dd" label="Moving Images [31142063429305]" type="Box">1</container><container parent="aspace_698559ee8dc5b6bd4cd89f0b516480dd" type="Media">ID: 426.0018</container><dao xlink:actuate="onRequest" xlink:href="https://hdl.handle.net/2333.1/cnp5hxpf" xlink:role="video-service" xlink:show="new" xlink:title="Gay USA 1/16/2003" xlink:type="simple"><daodesc><p>Gay USA 1/16/2003: January 16, 2003</p></daodesc></dao></did><phystech id="aspace_a3c042c8c734d84e831ca802031f9ce7"><head>Physical Characteristics and Technical Requirements</head><p>Color, sound</p><p>Duration: 60 minutes</p><p>Original format: DVCAM</p></phystech></c><c id="aspace_ref55" level="item"><did><unittitle>Gay USA 1/23/2003</unittitle><unitid>ID: 426.0019</unitid><physdesc altrender="whole"><extent altrender="materialtype spaceoccupied">1 media elements</extent><extent altrender="carrier">DVCAM</extent></physdesc><unitdate datechar="creation" normal="2003/2003" type="inclusive">January 23, 2003</unitdate><container altrender="Record carton" id="aspace_347a9c0c358c531efca9702a1148170e" label="Moving Images [31142063429305]" type="Box">1</container><container parent="aspace_347a9c0c358c531efca9702a1148170e" type="Media">ID: 426.0019</container><dao xlink:actuate="onRequest" xlink:href="https://hdl.handle.net/2333.1/7wm37x59" xlink:role="video-service" xlink:show="new" xlink:title="Gay USA 1/23/2003" xlink:type="simple"><daodesc><p>Gay USA 1/23/2003: January 23, 2003</p></daodesc></dao></did><phystech id="aspace_e092d228489a07595fea9a103012be59"><head>Physical Characteristics and Technical Requirements</head><p>Color, sound</p><p>Duration: 60 minutes</p><p>Original format: DVCAM</p></phystech></c><c id="aspace_ref58" level="item"><did><unittitle>Gay USA 1/30/2003</unittitle><unitid>ID: 426.0020</unitid><physdesc altrender="whole"><extent altrender="materialtype spaceoccupied">1 media elements</extent><extent altrender="carrier">DVCAM</extent></physdesc><unitdate datechar="creation" normal="2003/2003" type="inclusive">January 30, 2003</unitdate><container altrender="Record carton" id="aspace_29863517224ea02807dc9521c372994a" label="Moving Images [31142063429305]" type="Box">1</container><container parent="aspace_29863517224ea02807dc9521c372994a" type="Media">ID: 426.0020</container><dao xlink:actuate="onRequest" xlink:href="https://hdl.handle.net/2333.1/44j0zwnv" xlink:role="video-service" xlink:show="new" xlink:title="Gay USA 1/30/2003" xlink:type="simple"><daodesc><p>Gay USA 1/30/2003: January 30, 2003</p></daodesc></dao></did><phystech id="aspace_41afce0beff88ff78c1042e21e6712ce"><head>Physical Characteristics and Technical Requirements</head><p>Color, sound</p><p>Duration: 60 minutes</p><p>Original format: DVCAM</p></phystech></c><c id="aspace_ref61" level="item"><did><unittitle>Gay USA 2/06/2003</unittitle><unitid>ID: 426.0021</unitid><physdesc altrender="whole"><extent altrender="materialtype spaceoccupied">1 media elements</extent><extent altrender="carrier">DVCAM</extent></physdesc><unitdate datechar="creation" normal="2003/2003" type="inclusive">February 6, 2003</unitdate><container altrender="Record carton" id="aspace_0a9c69ca124d79f5a656d7db0427a260" label="Moving Images [31142063429305]" type="Box">1</container><container parent="aspace_0a9c69ca124d79f5a656d7db0427a260" type="Media">ID: 426.0021</container><dao xlink:actuate="onRequest" xlink:href="https://hdl.handle.net/2333.1/0cfxpw4m" xlink:role="video-service" xlink:show="new" xlink:title="Gay USA 2/06/2003" xlink:type="simple"><daodesc><p>Gay USA 2/06/2003: February 6, 2003</p></daodesc></dao></did><phystech id="aspace_62c7bbb023839671956882469f544037"><head>Physical Characteristics and Technical Requirements</head><p>Color, sound</p><p>Duration: 60 minutes</p><p>Original format: DVCAM</p></phystech></c><c id="aspace_ref64" level="item"><did><unittitle>Gay USA 2/14/2003</unittitle><unitid>ID: 426.0022</unitid><physdesc altrender="whole"><extent altrender="materialtype spaceoccupied">1 media elements</extent><extent altrender="carrier">DVCAM</extent></physdesc><unitdate datechar="creation" normal="2003/2003" type="inclusive">February 14, 2003</unitdate><container altrender="Record carton" id="aspace_45cb506a3066cf824fcb5722dca197b2" label="Moving Images [31142063429305]" type="Box">1</container><container parent="aspace_45cb506a3066cf824fcb5722dca197b2" type="Media">ID: 426.0022</container><dao xlink:actuate="onRequest" xlink:href="https://hdl.handle.net/2333.1/vmcvdvr7" xlink:role="video-service" xlink:show="new" xlink:title="Gay USA 2/14/2003" xlink:type="simple"><daodesc><p>Gay USA 2/14/2003: February 14, 2003</p></daodesc></dao></did><phystech id="aspace_3e91e50fcdb1f12cb1046bde359a3105"><head>Physical Characteristics and Technical Requirements</head><p>Color, sound</p><p>Duration: 60 minutes</p><p>Original format: DVCAM</p></phystech></c><c id="aspace_ref67" level="item"><did><unittitle>Gay USA 2/20/2003</unittitle><unitid>ID: 426.0023</unitid><physdesc altrender="whole"><extent altrender="materialtype spaceoccupied">1 media elements</extent><extent altrender="carrier">DVCAM</extent></physdesc><unitdate datechar="creation" normal="2003/2003" type="inclusive">February 20, 2003</unitdate><container altrender="Record carton" id="aspace_997500d8a721b359185ee26447511653" label="Moving Images [31142063429305]" type="Box">1</container><container parent="aspace_997500d8a721b359185ee26447511653" type="Media">ID: 426.0023</container><dao xlink:actuate="onRequest" xlink:href="https://hdl.handle.net/2333.1/qv9s4v73" xlink:role="video-service" xlink:show="new" xlink:title="Gay USA 2/20/2003" xlink:type="simple"><daodesc><p>Gay USA 2/20/2003: February 20, 2003</p></daodesc></dao></did><phystech id="aspace_6b7a39b156e0d9e5d24a8e16ad3e24fd"><head>Physical Characteristics and Technical Requirements</head><p>Color, sound</p><p>Duration: 60 minutes</p><p>Original format: DVCAM</p></phystech></c><c id="aspace_ref70" level="item"><did><unittitle>Gay USA 2/27/2003</unittitle><unitid>ID: 426.0024</unitid><physdesc altrender="whole"><extent altrender="materialtype spaceoccupied">1 media elements</extent><extent altrender="carrier">DVCAM</extent></physdesc><unitdate datechar="creation" normal="2003/2003" type="inclusive">February 27, 2003</unitdate><container altrender="Record carton" id="aspace_41d2676ca36580183a722529b829e844" label="Moving Images [31142063429305]" type="Box">1</container><container parent="aspace_41d2676ca36580183a722529b829e844" type="Media">ID: 426.0024</container><dao xlink:actuate="onRequest" xlink:href="https://hdl.handle.net/2333.1/m63xsrgz" xlink:role="video-service" xlink:show="new" xlink:title="Gay USA 2/27/2003" xlink:type="simple"><daodesc><p>Gay USA 2/27/2003: February 27, 2003</p></daodesc></dao></did><phystech id="aspace_05bc800ffdd0f2745021ea17b1db5a90"><head>Physical Characteristics and Technical Requirements</head><p>Color, sound</p><p>Duration: 60 minutes</p><p>Original format: DVCAM</p></phystech></c><c id="aspace_ref73" level="item"><did><unittitle>Gay USA 3/6/2003</unittitle><unitid>ID: 426.0025</unitid><physdesc altrender="whole"><extent altrender="materialtype spaceoccupied">1 media elements</extent><extent altrender="carrier">DVCAM</extent></physdesc><unitdate datechar="creation" normal="2003/2003" type="inclusive">March 6, 2003</unitdate><container altrender="Record carton" id="aspace_d4198c3f1deded49ef282c92f6f06917" label="Moving Images [31142063429305]" type="Box">1</container><container parent="aspace_d4198c3f1deded49ef282c92f6f06917" type="Media">ID: 426.0025</container><dao xlink:actuate="onRequest" xlink:href="https://hdl.handle.net/2333.1/gf1vhqzm" xlink:role="video-service" xlink:show="new" xlink:title="Gay USA 3/6/2003" xlink:type="simple"><daodesc><p>Gay USA 3/6/2003: March 6, 2003</p></daodesc></dao></did><phystech id="aspace_6346a2f60c551e7c0a249f2d8f3eb054"><head>Physical Characteristics and Technical Requirements</head><p>Color, sound</p><p>Duration: 60 minutes</p><p>Original format: DVCAM</p></phystech></c><c id="aspace_ref76" level="item"><did><unittitle>Gay USA 3/13/2003</unittitle><unitid>ID: 426.0026</unitid><physdesc altrender="whole"><extent altrender="materialtype spaceoccupied">1 media elements</extent><extent altrender="carrier">DVCAM</extent></physdesc><unitdate datechar="creation" normal="2003/2003" type="inclusive">March 13, 2003</unitdate><container altrender="Record carton" id="aspace_188bfc03cdf7d912650af7cfaf14319a" label="Moving Images [31142063429305]" type="Box">1</container><container parent="aspace_188bfc03cdf7d912650af7cfaf14319a" type="Media">ID: 426.0026</container><dao xlink:actuate="onRequest" xlink:href="https://hdl.handle.net/2333.1/bnzs7qfd" xlink:role="video-service" xlink:show="new" xlink:title="Gay USA 3/13/2003" xlink:type="simple"><daodesc><p>Gay USA 3/13/2003: March 13, 2003</p></daodesc></dao></did><phystech id="aspace_cd6b0667e3fa4737f79048d1a511f33b"><head>Physical Characteristics and Technical Requirements</head><p>Color, sound</p><p>Duration: 60 minutes</p><p>Original format: DVCAM</p><p>Recording date: March 11, 2003</p></phystech></c><c id="aspace_ref79" level="item"><did><unittitle>Gay USA 3/20/2003</unittitle><unitid>ID: 426.0027</unitid><physdesc altrender="whole"><extent altrender="materialtype spaceoccupied">1 media elements</extent><extent altrender="carrier">DVCAM</extent></physdesc><unitdate datechar="creation" normal="2003/2003" type="inclusive">March 20, 2003</unitdate><container altrender="Record carton" id="aspace_50ca8da182d9d69623b22034395a58de" label="Moving Images [31142063429305]" type="Box">1</container><container parent="aspace_50ca8da182d9d69623b22034395a58de" type="Media">ID: 426.0027</container><dao xlink:actuate="onRequest" xlink:href="https://hdl.handle.net/2333.1/6wwpzpxx" xlink:role="video-service" xlink:show="new" xlink:title="Gay USA 3/20/2003" xlink:type="simple"><daodesc><p>Gay USA 3/20/2003: March 20, 2003</p></daodesc></dao></did><phystech id="aspace_545bcc026e01b7f73ec8a5e97ce6d0ad"><head>Physical Characteristics and Technical Requirements</head><p>Color, sound</p><p>Duration: 60 minutes</p><p>Original format: DVCAM</p></phystech></c><c id="aspace_ref82" level="item"><did><unittitle>Gay USA 3/27/2003</unittitle><unitid>ID: 426.0028</unitid><physdesc altrender="whole"><extent altrender="materialtype spaceoccupied">1 media elements</extent><extent altrender="carrier">DVCAM</extent></physdesc><unitdate datechar="creation" normal="2003/2003" type="inclusive">March 27, 2003</unitdate><container altrender="Record carton" id="aspace_9e590ddb3cad1c257c75382b89dbdfff" label="Moving Images [31142063429305]" type="Box">1</container><container parent="aspace_9e590ddb3cad1c257c75382b89dbdfff" type="Media">ID: 426.0028</container><dao xlink:actuate="onRequest" xlink:href="https://hdl.handle.net/2333.1/34tmppf2" xlink:role="video-service" xlink:show="new" xlink:title="Gay USA 3/27/2003" xlink:type="simple"><daodesc><p>Gay USA 3/27/2003: March 27, 2003</p></daodesc></dao></did><phystech id="aspace_e1d0cf05cb96d86a91b00af5a9ea18b6"><head>Physical Characteristics and Technical Requirements</head><p>Color, sound</p><p>Duration: 60 minutes</p><p>Original format: DVCAM</p><p>Recording date: March 25, 2003</p></phystech></c><c id="aspace_ref89" level="item"><did><unittitle>Gay USA 4/3/2003</unittitle><unitid>ID: 426.0029</unitid><physdesc altrender="whole"><extent altrender="materialtype spaceoccupied">1 media elements</extent><extent altrender="carrier">DVCAM</extent></physdesc><unitdate datechar="creation" normal="2003/2003" type="inclusive">April 3, 2003</unitdate><container altrender="Record carton" id="aspace_80c8aa984329f9b2ffe8e3b4d69b1356" label="Moving Images [31142063429305]" type="Box">1</container><container parent="aspace_80c8aa984329f9b2ffe8e3b4d69b1356" type="Media">ID: 426.0029</container><dao xlink:actuate="onRequest" xlink:href="https://hdl.handle.net/2333.1/zcrjdp34" xlink:role="video-service" xlink:show="new" xlink:title="Gay USA 4/3/2003" xlink:type="simple"><daodesc><p>Gay USA 4/3/2003: April 3, 2003</p></daodesc></dao></did><phystech id="aspace_98eaa1b73a5090d53a487afd2bbfb9a8"><head>Physical Characteristics and Technical Requirements</head><p>Color, sound</p><p>Duration: 60 minutes</p><p>Original format: DVCAM</p><p>Recording date: April 1, 2003</p></phystech></c><c id="aspace_ref92" level="item"><did><unittitle>Gay USA 4/10/2003</unittitle><unitid>ID: 426.0030</unitid><physdesc altrender="whole"><extent altrender="materialtype spaceoccupied">1 media elements</extent><extent altrender="carrier">DVCAM</extent></physdesc><unitdate datechar="creation" normal="2003/2003" type="inclusive">April 10, 2003</unitdate><container altrender="Record carton" id="aspace_978539d631a8c2904d1466353abeeb92" label="Moving Images [31142063429305]" type="Box">1</container><container parent="aspace_978539d631a8c2904d1466353abeeb92" type="Media">ID: 426.0030</container><dao xlink:actuate="onRequest" xlink:href="https://hdl.handle.net/2333.1/tmpg4njj" xlink:role="video-service" xlink:show="new" xlink:title="Gay USA 4/10/2003" xlink:type="simple"><daodesc><p>Gay USA 4/10/2003: April 10, 2003</p></daodesc></dao></did><phystech id="aspace_d96d672fde671d9b7659511b7a526c46"><head>Physical Characteristics and Technical Requirements</head><p>Color, sound</p><p>Duration: 60 minutes</p><p>Original format: DVCAM</p><p>Recording time: April 8, 2003</p></phystech></c><c id="aspace_ref95" level="item"><did><unittitle>Gay USA 4/17/2003</unittitle><unitid>ID: 426.0031</unitid><physdesc altrender="whole"><extent altrender="materialtype spaceoccupied">1 media elements</extent><extent altrender="carrier">DVCAM</extent></physdesc><unitdate datechar="creation" normal="2003/2003" type="inclusive">April 17, 2003</unitdate><container altrender="Record carton" id="aspace_de8ee6ea679a5e3bb90b61f9454f612d" label="Moving Images [31142063429305]" type="Box">1</container><container parent="aspace_de8ee6ea679a5e3bb90b61f9454f612d" type="Media">ID: 426.0031</container><dao xlink:actuate="onRequest" xlink:href="https://hdl.handle.net/2333.1/pzgmsjqw" xlink:role="video-service" xlink:show="new" xlink:title="Gay USA 4/17/2003" xlink:type="simple"><daodesc><p>Gay USA 4/17/2003: April 17, 2003</p></daodesc></dao></did><phystech id="aspace_c431f012a7494ef011be868d801f5960"><head>Physical Characteristics and Technical Requirements</head><p>Color, sound</p><p>Duration: 60 minutes</p><p>Original format: DVCAM</p><p>Recording time: April 15, 2003</p></phystech></c><c id="aspace_ref98" level="item"><did><unittitle>Gay USA 4/24/2003</unittitle><unitid>ID: 426.0032</unitid><physdesc altrender="whole"><extent altrender="materialtype spaceoccupied">1 media elements</extent><extent altrender="carrier">DVCAM</extent></physdesc><unitdate datechar="creation" normal="2003/2003" type="inclusive">April 24, 2003</unitdate><container altrender="Record carton" id="aspace_92bccc75da19e0f07c1f2e4754c2a22c" label="Moving Images [31142063429305]" type="Box">1</container><container parent="aspace_92bccc75da19e0f07c1f2e4754c2a22c" type="Media">ID: 426.0032</container><dao xlink:actuate="onRequest" xlink:href="https://hdl.handle.net/2333.1/k6djhj6s" xlink:role="video-service" xlink:show="new" xlink:title="Gay USA 4/24/2003" xlink:type="simple"><daodesc><p>Gay USA 4/24/2003: April 24, 2003</p></daodesc></dao></did><phystech id="aspace_c8793bbda437e49ff758e4a12904e1c0"><head>Physical Characteristics and Technical Requirements</head><p>Color, sound</p><p>Duration: 60 minutes</p><p>Original format: DVCAM</p><p>Recording date: April 22, 2003</p></phystech></c><c id="aspace_ref101" level="item"><did><unittitle>Gay USA 5/1/2003</unittitle><unitid>ID: 426.0033</unitid><physdesc altrender="whole"><extent altrender="materialtype spaceoccupied">1 media elements</extent><extent altrender="carrier">DVCAM</extent></physdesc><unitdate datechar="creation" normal="2003/2003" type="inclusive">May 1, 2003</unitdate><container altrender="Record carton" id="aspace_7da7a44b2058c3f326f7c5490c81ba50" label="Moving Images [31142063429305]" type="Box">1</container><container parent="aspace_7da7a44b2058c3f326f7c5490c81ba50" type="Media">ID: 426.0033</container><dao xlink:actuate="onRequest" xlink:href="https://hdl.handle.net/2333.1/ffbg7hpf" xlink:role="video-service" xlink:show="new" xlink:title="Gay USA 5/1/2003" xlink:type="simple"><daodesc><p>Gay USA 5/1/2003: May 1, 2003</p></daodesc></dao></did><phystech id="aspace_473d0c45749747f4eadcfb35caa4af74"><head>Physical Characteristics and Technical Requirements</head><p>Color, sound</p><p>Duration: 60 minutes</p><p>Original format: DVCAM</p><p>Recording date: April 29, 2003</p></phystech></c><c id="aspace_ref104" level="item"><did><unittitle>Gay USA 5/8/2003</unittitle><unitid>ID: 426.0034</unitid><physdesc altrender="whole"><extent altrender="materialtype spaceoccupied">1 media elements</extent><extent altrender="carrier">DVCAM</extent></physdesc><unitdate datechar="creation" normal="2003/2003" type="inclusive">May 8, 2003</unitdate><container altrender="Record carton" id="aspace_adc0353223caa376c0c278f3f60ae1c0" label="Moving Images [31142063429305]" type="Box">1</container><container parent="aspace_adc0353223caa376c0c278f3f60ae1c0" type="Media">ID: 426.0034</container><dao xlink:actuate="onRequest" xlink:href="https://hdl.handle.net/2333.1/9p8czh55" xlink:role="video-service" xlink:show="new" xlink:title="Gay USA 5/8/2003" xlink:type="simple"><daodesc><p>Gay USA 5/8/2003: May 8, 2003</p></daodesc></dao></did><phystech id="aspace_ea5c86ba68c5f0772040dadf63ee6f20"><head>Physical Characteristics and Technical Requirements</head><p>Color, sound</p><p>Duration: 60 minutes</p><p>Original format: DVCAM</p></phystech></c><c id="aspace_ref107" level="item"><did><unittitle>Gay USA 5/15/2003</unittitle><unitid>ID: 426.0035</unitid><physdesc altrender="whole"><extent altrender="materialtype spaceoccupied">1 media elements</extent><extent altrender="carrier">DVCAM</extent></physdesc><unitdate datechar="creation" normal="2003/2003" type="inclusive">May 15, 2003</unitdate><container altrender="Record carton" id="aspace_9d486719b955ed786c21d2a12affc32c" label="Moving Images [31142063429305]" type="Box">1</container><container parent="aspace_9d486719b955ed786c21d2a12affc32c" type="Media">ID: 426.0035</container><dao xlink:actuate="onRequest" xlink:href="https://hdl.handle.net/2333.1/5x69pgnt" xlink:role="video-service" xlink:show="new" xlink:title="Gay USA 5/15/2003" xlink:type="simple"><daodesc><p>Gay USA 5/15/2003: May 15, 2003</p></daodesc></dao></did><phystech id="aspace_97357cf768fba33c1b9934a2de790dd8"><head>Physical Characteristics and Technical Requirements</head><p>Color, sound</p><p>Duration: 60 minutes</p><p>Original format: DVCAM</p><p>Recording date: May 12, 2003</p></phystech></c><c id="aspace_ref110" level="item"><did><unittitle>Gay USA 5/22/2003</unittitle><unitid>ID: 426.0036</unitid><physdesc altrender="whole"><extent altrender="materialtype spaceoccupied">1 media elements</extent><extent altrender="carrier">DVCAM</extent></physdesc><unitdate datechar="creation" normal="2003/2003" type="inclusive">May 22, 2003</unitdate><container altrender="Record carton" id="aspace_3fe425bd561d0aca978e042ab8a93b95" label="Moving Images [31142063429305]" type="Box">1</container><container parent="aspace_3fe425bd561d0aca978e042ab8a93b95" type="Media">ID: 426.0036</container><dao xlink:actuate="onRequest" xlink:href="https://hdl.handle.net/2333.1/2547dg4q" xlink:role="video-service" xlink:show="new" xlink:title="Gay USA 5/22/2003" xlink:type="simple"><daodesc><p>Gay USA 5/22/2003: May 22, 2003</p></daodesc></dao></did><phystech id="aspace_e335a5334d01c26476e4833ad82cf4de"><head>Physical Characteristics and Technical Requirements</head><p>Color, sound</p><p>Duration: 60 minutes</p><p>Original format: DVCAM</p></phystech></c><c id="aspace_ref113" level="item"><did><unittitle>Gay USA 5/29/2003</unittitle><unitid>ID: 426.0037</unitid><physdesc altrender="whole"><extent altrender="materialtype spaceoccupied">1 media elements</extent><extent altrender="carrier">DVCAM</extent></physdesc><unitdate datechar="creation" normal="2003/2003" type="inclusive">May 29, 2003</unitdate><container altrender="Record carton" id="aspace_b93a06d0adfae37c228a46282b07cd8c" label="Moving Images [31142063429305]" type="Box">1</container><container parent="aspace_b93a06d0adfae37c228a46282b07cd8c" type="Media">ID: 426.0037</container><dao xlink:actuate="onRequest" xlink:href="https://hdl.handle.net/2333.1/xd254fsk" xlink:role="video-service" xlink:show="new" xlink:title="Gay USA 5/29/2003" xlink:type="simple"><daodesc><p>Gay USA 5/29/2003: May 29, 2003</p></daodesc></dao></did><phystech id="aspace_f04c63e13f452dfe7e6de22cfd633896"><head>Physical Characteristics and Technical Requirements</head><p>Color, sound</p><p>Duration: 60 minutes</p><p>Original format: DVCAM</p><p>Recording date: May 27, 2003</p></phystech></c><c id="aspace_ref117" level="item"><did><unittitle>Gay USA 6/5/2003</unittitle><unitid>ID: 426.0038</unitid><physdesc altrender="whole"><extent altrender="materialtype spaceoccupied">1 media elements</extent><extent altrender="carrier">DVCAM</extent></physdesc><unitdate datechar="creation" normal="2003/2003" type="inclusive">June 5, 2003</unitdate><container altrender="Record carton" id="aspace_8ff13220291c4cd744b89d654a6ce16c" label="Moving Images [31142063429305]" type="Box">1</container><container parent="aspace_8ff13220291c4cd744b89d654a6ce16c" type="Media">ID: 426.0038</container><dao xlink:actuate="onRequest" xlink:href="https://hdl.handle.net/2333.1/sqv9sc09" xlink:role="video-service" xlink:show="new" xlink:title="Gay USA 6/5/2003" xlink:type="simple"><daodesc><p>Gay USA 6/5/2003: June 5, 2003</p></daodesc></dao></did><phystech id="aspace_1fdff62d62a54fdda42ffac7b1a771ab"><head>Physical Characteristics and Technical Requirements</head><p>Color, sound</p><p>Duration: 60 minutes</p><p>Original format: DVCAM</p><p>Recording date: June 3, 2003</p></phystech></c><c id="aspace_ref120" level="item"><did><unittitle>Gay USA 6/12/2003</unittitle><unitid>ID: 426.0039</unitid><physdesc altrender="whole"><extent altrender="materialtype spaceoccupied">1 media elements</extent><extent altrender="carrier">DVCAM</extent></physdesc><unitdate datechar="creation" normal="2003/2003" type="inclusive">June 12, 2003</unitdate><container altrender="Record carton" id="aspace_ca7adec1cdfdee5e3926a1799ecd88cc" label="Moving Images [31142063429305]" type="Box">1</container><container parent="aspace_ca7adec1cdfdee5e3926a1799ecd88cc" type="Media">ID: 426.0039</container><dao xlink:actuate="onRequest" xlink:href="https://hdl.handle.net/2333.1/nzs7hbgz" xlink:role="video-service" xlink:show="new" xlink:title="Gay USA 6/12/2003" xlink:type="simple"><daodesc><p>Gay USA 6/12/2003: June 12, 2003</p></daodesc></dao></did><phystech id="aspace_047155709ec855e298bea4c977442aa0"><head>Physical Characteristics and Technical Requirements</head><p>Color, sound</p><p>Duration: 60 minutes</p><p>Original format: DVCAM</p><p>Recording date: June 10, 2003</p></phystech></c><c id="aspace_ref123" level="item"><did><unittitle>Gay USA 6/19/2003</unittitle><unitid>ID: 426.0040</unitid><physdesc altrender="whole"><extent altrender="materialtype spaceoccupied">1 media elements</extent><extent altrender="carrier">DVCAM</extent></physdesc><unitdate datechar="creation" normal="2003/2003" type="inclusive">June 19, 2003</unitdate><container altrender="Record carton" id="aspace_fea6426527e9bd3385cd3e3b198c4fd8" label="Moving Images [31142063429305]" type="Box">1</container><container parent="aspace_fea6426527e9bd3385cd3e3b198c4fd8" type="Media">ID: 426.0040</container><dao xlink:actuate="onRequest" xlink:href="https://hdl.handle.net/2333.1/j6q579zn" xlink:role="video-service" xlink:show="new" xlink:title="Gay USA 6/19/2003" xlink:type="simple"><daodesc><p>Gay USA 6/19/2003: June 19, 2003</p></daodesc></dao></did><phystech id="aspace_7f7e89da9616b60402f9599ae36b59ed"><head>Physical Characteristics and Technical Requirements</head><p>Color, sound</p><p>Duration: 60 minutes</p><p>Original format: DVCAM</p><p>Recording date: June 17, 2003</p></phystech></c><c id="aspace_ref126" level="item"><did><unittitle>Gay USA 6/26/2003 - Live Special</unittitle><unitid>ID: 426.0041</unitid><physdesc altrender="whole"><extent altrender="materialtype spaceoccupied">1 media elements</extent><extent altrender="carrier">DVCAM</extent></physdesc><unitdate datechar="creation" normal="2003/2003" type="inclusive">June 26, 2003</unitdate><container altrender="Record carton" id="aspace_a6d182fe483f2f11bcbffe1ed52de25c" label="Moving Images [31142063429305]" type="Box">1</container><container parent="aspace_a6d182fe483f2f11bcbffe1ed52de25c" type="Media">ID: 426.0041</container><dao xlink:actuate="onRequest" xlink:href="https://hdl.handle.net/2333.1/dfn2z9fc" xlink:role="video-service" xlink:show="new" xlink:title="Gay USA 6/26/2003 - Live Special" xlink:type="simple"><daodesc><p>Gay USA 6/26/2003 - Live Special: June 26, 2003</p></daodesc></dao></did><phystech id="aspace_55dfb642a969834e092017d04a8fac46"><head>Physical Characteristics and Technical Requirements</head><p>Color, sound</p><p>Duration: 60 minutes</p><p>Original format: DVCAM</p></phystech></c><c id="aspace_ref129" level="item"><did><unittitle>Gay USA 6/26/2003</unittitle><unitid>ID: 426.0042</unitid><physdesc altrender="whole"><extent altrender="materialtype spaceoccupied">1 media elements</extent><extent altrender="carrier">DVCAM</extent></physdesc><unitdate datechar="creation" normal="2003/2003" type="inclusive">June 26, 2003</unitdate><container altrender="Record carton" id="aspace_18a6c9b4a978553e068859859e285d1c" label="Moving Images [31142063429305]" type="Box">1</container><container parent="aspace_18a6c9b4a978553e068859859e285d1c" type="Media">ID: 426.0042</container><dao xlink:actuate="onRequest" xlink:href="https://hdl.handle.net/2333.1/8pk0p8z8" xlink:role="video-service" xlink:show="new" xlink:title="Gay USA 6/26/2003" xlink:type="simple"><daodesc><p>Gay USA 6/26/2003: June 26, 2003</p></daodesc></dao></did><phystech id="aspace_38251aa2cd36052cf487ec53c8a9da05"><head>Physical Characteristics and Technical Requirements</head><p>Color, sound</p><p>Duration: 60 minutes</p><p>Original format: DVCAM</p><p>Recording date: June 24, 2003</p></phystech></c><c id="aspace_ref132" level="item"><did><unittitle>Gay USA 7/3/2003</unittitle><unitid>ID: 426.0043</unitid><physdesc altrender="whole"><extent altrender="materialtype spaceoccupied">1 media elements</extent><extent altrender="carrier">DVCAM</extent></physdesc><unitdate datechar="creation" normal="2003/2003" type="inclusive">July 3, 2003</unitdate><container altrender="Record carton" id="aspace_a3a9ed84a4286c6e3436b586e0e22c27" label="Moving Images [31142063429305]" type="Box">1</container><container parent="aspace_a3a9ed84a4286c6e3436b586e0e22c27" type="Media">ID: 426.0043</container><dao xlink:actuate="onRequest" xlink:href="https://hdl.handle.net/2333.1/4xgxd8f1" xlink:role="video-service" xlink:show="new" xlink:title="Gay USA 7/3/2003" xlink:type="simple"><daodesc><p>Gay USA 7/3/2003: July 3, 2003</p></daodesc></dao></did><phystech id="aspace_5664a0ccbe22db53eaf95d3afda21805"><head>Physical Characteristics and Technical Requirements</head><p>Color, sound</p><p>Duration: 60 minutes</p><p>Original format: DVCAM</p><p>Recording date: July 1, 2003</p></phystech></c><c id="aspace_ref133" level="item"><did><unittitle>GAY USA 7/10/2003</unittitle><unitid>ID: 426.0044</unitid><physdesc altrender="whole"><extent altrender="materialtype spaceoccupied">1 media elements</extent><extent altrender="carrier">DVCAM</extent></physdesc><unitdate datechar="creation" normal="2003/2003" type="inclusive">July 10, 2003</unitdate><container altrender="Record carton" id="aspace_01511277508111918e265f3744df1f53" label="Moving Images [31142063429305]" type="Box">1</container><container parent="aspace_01511277508111918e265f3744df1f53" type="Media">ID: 426.0044</container><dao xlink:actuate="onRequest" xlink:href="https://hdl.handle.net/2333.1/189325p4" xlink:role="video-service" xlink:show="new" xlink:title="GAY USA 7/10/2003" xlink:type="simple"><daodesc><p>GAY USA 7/10/2003: July 10, 2003</p></daodesc></dao></did><phystech id="aspace_35826ec3def207d1ac62efe7e6ce50a6"><head>Physical Characteristics and Technical Requirements</head><p>Color, sound</p><p>Duration: 60 minutes</p><p>Original format: DVCAM</p></phystech></c><c id="aspace_ref138" level="item"><did><unittitle>Gay USA 7/17/2003</unittitle><unitid>ID: 426.0045</unitid><physdesc altrender="whole"><extent altrender="materialtype spaceoccupied">1 media elements</extent><extent altrender="carrier">DVCAM</extent></physdesc><unitdate datechar="creation" normal="2003/2003" type="inclusive">July 17, 2003</unitdate><container altrender="Record carton" id="aspace_1bde7cd6d48166f6190d6667154403bf" label="Moving Images [31142063429305]" type="Box">1</container><container parent="aspace_1bde7cd6d48166f6190d6667154403bf" type="Media">ID: 426.0045</container><dao xlink:actuate="onRequest" xlink:href="https://hdl.handle.net/2333.1/wh70s59t" xlink:role="video-service" xlink:show="new" xlink:title="Gay USA 7/17/2003" xlink:type="simple"><daodesc><p>Gay USA 7/17/2003: July 17, 2003</p></daodesc></dao></did><phystech id="aspace_b44921f87268150e67abb3f3ee099025"><head>Physical Characteristics and Technical Requirements</head><p>Color, sound</p><p>Duration: 60 minutes</p><p>Original format: DVCAM</p></phystech></c><c id="aspace_ref141" level="item"><did><unittitle>Gay USA 7/24/2003</unittitle><unitid>ID: 426.0046</unitid><physdesc altrender="whole"><extent altrender="materialtype spaceoccupied">1 media elements</extent><extent altrender="carrier">DVCAM</extent></physdesc><unitdate datechar="creation" normal="2003/2003" type="inclusive">July 24, 2003</unitdate><container altrender="Record carton" id="aspace_1186c25cd94e7e35568e8f5ec4843e4b" label="Moving Images [31142063429305]" type="Box">1</container><container parent="aspace_1186c25cd94e7e35568e8f5ec4843e4b" type="Media">ID: 426.0046</container><dao xlink:actuate="onRequest" xlink:href="https://hdl.handle.net/2333.1/rr4xh4sc" xlink:role="video-service" xlink:show="new" xlink:title="Gay USA 7/24/2003" xlink:type="simple"><daodesc><p>Gay USA 7/24/2003: July 24, 2003</p></daodesc></dao></did><phystech id="aspace_71f9c3331a4cde8a8e2ee8eae1438321"><head>Physical Characteristics and Technical Requirements</head><p>Color, sound</p><p>Duration: 60 minutes</p><p>Original format: DVCAM</p></phystech></c><c id="aspace_ref144" level="item"><did><unittitle>Gay USA 7/31/2003</unittitle><unitid>ID: 426.0047</unitid><physdesc altrender="whole"><extent altrender="materialtype spaceoccupied">1 media elements</extent><extent altrender="carrier">DVCAM</extent></physdesc><unitdate datechar="creation" normal="2003/2003" type="inclusive">July 31, 2003</unitdate><container altrender="Record carton" id="aspace_badc41cbd72b7cdc1f3061f2e7f751c7" label="Moving Images [31142063429305]" type="Box">1</container><container parent="aspace_badc41cbd72b7cdc1f3061f2e7f751c7" type="Media">ID: 426.0047</container><dao xlink:actuate="onRequest" xlink:href="https://hdl.handle.net/2333.1/n02v7488" xlink:role="video-service" xlink:show="new" xlink:title="Gay USA 7/31/2003" xlink:type="simple"><daodesc><p>Gay USA 7/31/2003: July 31, 2003</p></daodesc></dao></did><phystech id="aspace_7f1fd32f3a0eb2f5ee70e8ca7bf49d33"><head>Physical Characteristics and Technical Requirements</head><p>Color, sound</p><p>Duration: 60 minutes</p><p>Original format: DVCAM</p></phystech></c><c id="aspace_ref147" level="item"><did><unittitle>Gay USA 8/7/2003</unittitle><unitid>ID: 426.0048</unitid><physdesc altrender="whole"><extent altrender="materialtype spaceoccupied">1 media elements</extent><extent altrender="carrier">DVCAM</extent></physdesc><unitdate datechar="creation" normal="2003/2003" type="inclusive">August 7, 2003</unitdate><container altrender="Record carton" id="aspace_661a3ab1efeea2ae0dd51e580ca5c695" label="Moving Images [31142063429305]" type="Box">1</container><container parent="aspace_661a3ab1efeea2ae0dd51e580ca5c695" type="Media">ID: 426.0048</container><dao xlink:actuate="onRequest" xlink:href="https://hdl.handle.net/2333.1/h70rz3rs" xlink:role="video-service" xlink:show="new" xlink:title="Gay USA 8/7/2003" xlink:type="simple"><daodesc><p>Gay USA 8/7/2003: August 7, 2003</p></daodesc></dao></did><phystech id="aspace_ae45751291bf0354fd3ce31febb34fa6"><head>Physical Characteristics and Technical Requirements</head><p>Color, sound</p><p>Duration: 60 minutes</p><p>Original format: DVCAM</p></phystech></c><c id="aspace_ref150" level="item"><did><unittitle>Gay USA 8/14/2003</unittitle><unitid>ID: 426.0049</unitid><physdesc altrender="whole"><extent altrender="materialtype spaceoccupied">1 media elements</extent><extent altrender="carrier">DVCAM</extent></physdesc><unitdate datechar="creation" normal="2003/2003" type="inclusive">August 14, 2003</unitdate><container altrender="Record carton" id="aspace_d5c8f9c95e2ed98397d8ed944c910e8c" label="Moving Images [31142063429305]" type="Box">1</container><container parent="aspace_d5c8f9c95e2ed98397d8ed944c910e8c" type="Media">ID: 426.0049</container><dao xlink:actuate="onRequest" xlink:href="https://hdl.handle.net/2333.1/cfxpp37k" xlink:role="video-service" xlink:show="new" xlink:title="Gay USA 8/14/2003" xlink:type="simple"><daodesc><p>Gay USA 8/14/2003: August 14, 2003</p></daodesc></dao></did><phystech id="aspace_926b4ea65c7ccdcdb6225813b68b85dd"><head>Physical Characteristics and Technical Requirements</head><p>Color, sound</p><p>Duration: 60 minutes</p><p>Original format: DVCAM</p></phystech></c><c id="aspace_ref153" level="item"><did><unittitle>Gay USA 8/21/2003</unittitle><unitid>ID: 426.0050</unitid><physdesc altrender="whole"><extent altrender="materialtype spaceoccupied">1 media elements</extent><extent altrender="carrier">DVCAM</extent></physdesc><unitdate datechar="creation" normal="2003/2003" type="inclusive">August 21, 2003</unitdate><container altrender="Record carton" id="aspace_8ade3f3f833db1badda9c53df1ca4977" label="Moving Images [31142063429305]" type="Box">1</container><container parent="aspace_8ade3f3f833db1badda9c53df1ca4977" type="Media">ID: 426.0050</container><dao xlink:actuate="onRequest" xlink:href="https://hdl.handle.net/2333.1/7pvmd2rg" xlink:role="video-service" xlink:show="new" xlink:title="Gay USA 8/21/2003" xlink:type="simple"><daodesc><p>Gay USA 8/21/2003: August 21, 2003</p></daodesc></dao></did><phystech id="aspace_cf319be2a336de4a5e6b526e8aa4c17e"><head>Physical Characteristics and Technical Requirements</head><p>Color, sound</p><p>Duration: 60 minutes</p><p>Original format: DVCAM</p></phystech></c><c id="aspace_ref156" level="item"><did><unittitle>Gay USA 8/28/2003</unittitle><unitid>ID: 426.0051</unitid><physdesc altrender="whole"><extent altrender="materialtype spaceoccupied">1 media elements</extent><extent altrender="carrier">DVCAM</extent></physdesc><unitdate datechar="creation" normal="2003/2003" type="inclusive">August 28, 2003</unitdate><container altrender="Record carton" id="aspace_0acf720d017db277320e4c76524457e0" label="Moving Images [31142063429305]" type="Box">1</container><container parent="aspace_0acf720d017db277320e4c76524457e0" type="Media">ID: 426.0051</container><dao xlink:actuate="onRequest" xlink:href="https://hdl.handle.net/2333.1/41ns1zwk" xlink:role="video-service" xlink:show="new" xlink:title="G